"Timecode","Content","Content_zh"
"00:35:33,098 --> 00:35:38,036","Uh, yeah, I think--it's--I'm, like, interested to see how it's gonna go, you know?","嗯，對，我很想看看它最後會變成怎樣。"
"00:35:38,036 --> 00:35:41,373","Like I hope those guys don't hate my paintings of their paintings.","我希望那些人不會討厭我把他們的畫重新畫成我的版本。"
"00:35:41,373 --> 00:35:45,610","You know, it's awesome 'cause they're just gonna be in a sweet painting world.","這很棒，因為他們會進到一個超讚的繪畫世界裡。"
"00:35:45,610 --> 00:35:52,317","Like, that's-- that gets me pumped that people are gonna be able to, like, explore my paintings, you know?","這點讓我很興奮，因為大家可以探索我的畫作，你懂嗎？"
"00:35:55,186 --> 00:35:57,689","Rice: That's hilarious.","Rice：真好笑"
"00:35:57,689 --> 00:36:02,394","Bagel: That's amazing, though, dude. Rice: Oh, man, that's super good.","Bagel：不過那真的很厲害，老兄。Rice：天啊，超棒的。"
"00:36:02,394 --> 00:36:08,466","Crook: So I'm actually scaling the arms a little bit so that it feels like they go-- Yeah, they get a little bit of perspective.","Crook：所以我其實把手臂稍微縮放了一下，讓它感覺像是……對，有一點透視感。"
"00:36:08,466 --> 00:36:09,801","And the feet. Rice: Yeah.","還有腳。Rice：對。"
"00:36:09,801 --> 00:36:13,104","Bagel: That totally, uh, that totally works.","Bagel：那完全……那完全可行。"
"00:36:13,104 --> 00:36:18,143","Petty: It's weird, it's a hybrid process 'cause it's like you're doing a 2D painting, but then we do have to get it on a 3D geometry,","Petty：這很奇妙，是一種混合流程，因為你像是在做 2D 繪圖，但我們又得把它放到 3D 幾何上，"
"00:36:18,143 --> 00:36:22,747","so it has some of the cleanup work as if it were a real 3D-- like a full 3D model.","所以也有一些清理工作，像真的 3D，像完整 3D 模型那樣。"
"00:36:22,747 --> 00:36:29,821","Bagel: It depends on how complicated we're gonna get with all the parallaxing and, you know, I have never had to worry about memory issues","Bagel：這要看我們要把視差做得多複雜，而且我以前從來不用擔心記憶體問題"
"00:36:29,821 --> 00:36:38,463","in painting and restrictions, you know, technical restrictions or anything like that, so, yeah,","畫畫時從來不用擔心限制，像技術限制之類的，所以，對，"
"00:36:38,463 --> 00:36:42,667","I mean, it's really, like, gonna be a crazy learning process at the same time, you know?","我是說，這同時也會是很瘋狂的學習過程。"
"00:36:42,667 --> 00:36:52,310","Yeah, putting it all together and makin' it into a working, functional, moving world is, like, I haven't really done that before, so this is a whole--a whole new world.","對，把這些全部組起來，變成一個能運作、有功能、會動的世界，我以前真的沒做過，所以這完全是個新世界。"
"00:36:52,310 --> 00:37:00,151","If I were to say, like, ""Ah, here's this-- here's, like, him the most lit he's gonna be."" Uh, you know, ""Here's him dark as he's gonna be,""","如果我說：「啊，這是他最亮時的樣子。」或是「這是他最暗時的樣子。」"
"00:37:00,151 --> 00:37:03,354","and then, like, you're--okay-- Petty: But I think it solves a different problem, right?","然後你就……好吧。Petty：但我覺得那是在解決另一個問題，對吧？"
"00:37:03,354 --> 00:37:07,792","We're talking about-- like, I think the general color gradients, I think, look good.","我們在說的是……我覺得整體的色彩漸層看起來不錯。"
"00:37:07,792 --> 00:37:09,994","I think the rim lighting is a different thing.","我覺得邊緣光是另一回事。"
"00:37:09,994 --> 00:37:14,999","That's not about lighting as much as it is, like, when there's an intense light source around.","那與其說是一般打光，不如說是周圍有強烈光源時會出現的效果。"
"00:37:14,999 --> 00:37:18,570","It's about just putting a little bit on there to, like, tie him into the scene.","只是稍微加一點，讓他融入場景。"
"00:37:18,570 --> 00:37:21,740","I think, I mean, you read the comments at the forum, and like everyone found it very appealing.","我是說，你看論壇上的留言，大家都覺得很吸引人。"
"00:37:21,740 --> 00:37:24,409","It really helped the tie-in. Bagel: Yeah?","那真的有助於把他融入場景。Bagel：是嗎？"
"00:37:24,409 --> 00:37:27,312","Schafer: Yeah, Bagel is not, um, really, you know, technical.","Schafer：對，Bagel 不是那麼技術取向的人。"
"00:37:27,312 --> 00:37:29,013","He likes to paint.","他喜歡畫畫"
"00:37:29,013 --> 00:37:40,058","He likes to paint on, you know, canvas and paper, and, uh, um, and that's why it's really invaluable to have someone like Lee Petty on the team who can bridge that gap.","他喜歡在畫布和紙上畫畫，所以團隊裡有 Lee Petty 這樣能銜接兩邊的人，真的非常寶貴。"
"00:37:40,058 --> 00:37:46,498","He's a fine artist himself, he can draw, he can paint, but he also knows how to use, um, incredibly advanced,","他自己也是純藝術家，會畫圖、會繪畫，但他也懂得使用非常進階的"
"00:37:46,498 --> 00:37:52,137","you know, techniques and 3D rendering, and, you know, just making games that, you know, a lot of programmers, you know,","那些技術和 3D 算圖，還有做遊戲這件事。很多程式設計師，"
"00:37:52,137 --> 00:37:56,508","he can match programmers sometimes with the knowledge of, um...","有時候他的知識量甚至能跟程式設計師相比……"
"00:37:56,508 --> 00:37:58,443","He's got a lot of knowledge. That's what I'm trying to say.","他懂很多。這就是我想說的。"
"00:37:58,443 --> 00:38:01,513","So it's great to have someone like Lee around who can bridge that gap.","所以身邊有 Lee 這樣能銜接落差的人真的很棒。"
"00:38:01,513 --> 00:38:05,049","Petty: That's why I was saying earlier, don't paint the character dark because you can never get lighter.","Petty：所以我剛才才說，不要把角色畫得太暗，因為之後就很難再變亮。"
"00:38:05,049 --> 00:38:08,119","We want to generally paint him pretty light like this 'cause then he can get darker.","我們通常會想把他畫得像這樣偏亮，因為之後還可以變暗。"
"00:38:08,119 --> 00:38:14,826","Schafer: If you can span both worlds, it's really essential, 'cause you can work with a great artist, but then if that doesn't really translate into the game,","Schafer：如果你能橫跨兩個世界，那真的很重要。因為你可以和很棒的藝術家合作，但如果那些東西沒辦法真正轉進遊戲裡，"
"00:38:14,826 --> 00:38:18,830","you can be, um, it's just a waste.","那就只是浪費而已。"
"00:38:18,830 --> 00:38:24,636","Chan: Yeah, I'm--I'm curious as much as you are, and I have faith that it'll work.","Chan：是的，我…… 我和你一樣好奇，我相信它會成功。"
"00:38:24,636 --> 00:38:33,077","I mean, Tim--see, that's the thing is like, Tim says, ""This is what I--I want to showcase Bagel's style.""","我是說，Tim……你看，重點就是 Tim 說：「我想展現 Bagel 的風格。」"
"00:38:33,077 --> 00:38:36,347","Perfect. I think that's a great idea.","很好 我覺得這是個好主意"
"00:38:36,347 --> 00:38:39,317","And so I trust him.","所以我信任他"
"00:38:39,317 --> 00:38:42,720","If that's what he wants, then-- then there's something there.","如果那是他想要的，那其中一定有道理。"
"00:38:44,322 --> 00:38:46,024","Bagel: Ooh!","Bagel：哦！"
"00:38:46,024 --> 00:38:47,392","Petty: All right, Ray. Crook: Go back to your jam.","Petty：好吧，Ray。Crook：回去繼續你的集思會。"
"00:38:47,392 --> 00:38:48,827","Petty: All right. Bagel: Jam out.","Petty：好。Bagel：繼續集思。"
"00:38:48,827 --> 00:38:50,028","Crook: All right, guys.","Crook：好了，各位。"
"00:38:50,580 --> 00:39:40,011","[Music] Schafer: You know, very early on, I sometimes have","[音樂] Schafer：你知道，在很早期，我有時候會做"
"00:39:40,011 --> 00:39:42,614","these stress nightmares about the game not existing yet.","那種遊戲還不存在的壓力惡夢。"
"00:39:42,614 --> 00:39:49,420","I used to have these nightmares about levels in ""Psychonauts"" that didn't exist yet, and like, I was floating in the undesigned world","我以前常夢到《Psychonauts》裡還不存在的關卡，像是漂浮在尚未設計好的世界裡"
"00:39:49,420 --> 00:39:50,855","and couldn't grab onto anything.","卻抓不到任何東西。"
"00:39:50,855 --> 00:39:56,227","It's just like, it's the stress of things that you haven't really pulled together yet.","那就是那些你還沒真正整合起來的東西帶來的壓力。"
"00:39:56,227 --> 00:40:00,164","And these are like little life preservers and the-- floating in the ocean, like, you grab onto them like,","這些就像小救生圈，漂在海上，你抓住它們，像是："
"00:40:00,164 --> 00:40:07,105","""Ah, ah, now I can breathe and, like, look around and see what else I can pull together to make a raft out of,"" you know?","「啊，現在我可以呼吸了，可以看看周圍還有什麼能湊起來做成一艘筏子。」你懂嗎？"
"00:40:07,105 --> 00:40:08,139","That's a metaphor.","那是個比喻"
"00:40:08,139 --> 00:40:10,608","I like how it's like lighthouse with the haunted house on top of it.","我喜歡上面有鬼屋的燈塔"
"00:40:10,608 --> 00:40:13,645","Petty: Yeah, it's basic-- Chan: I can go home now? Schafer: What?","Petty：對，基本上……Chan：我現在可以回家了嗎？Schafer：什麼？"
"00:40:13,645 --> 00:40:15,146","Petty: Peter Chan. Bagel: Thank you.","Petty：Peter Chan。Bagel：謝謝你。"
"00:40:15,146 --> 00:40:18,016","Schafer: Peter Chan, yeah, Peter Chan.","Schafer：Peter Chan，對，Peter Chan。"
"00:40:18,016 --> 00:40:20,451","Oh, Bagel's posting! Bagel, Bagel.","喔，Bagel 要貼了！Bagel，Bagel。"
"00:40:20,451 --> 00:40:22,487","Chan: Bagel!","Chan：Bagel！"
"00:40:22,487 --> 00:40:23,621","Bagel: Yeah. Chan: Yeah.","Bagel：對。Chan：對。"
"00:40:23,621 --> 00:40:24,789","Bagel: Jump in there.","Bagel：加進去。"
"00:40:24,789 --> 00:40:27,525","Schafer: Bagel.","Schafer：Bagel。"
"00:40:27,525 --> 00:40:30,561","Okay. Bagel: Floating island maybe that-- Schafer: What's on the floating island?","好。Bagel：浮島也許會……Schafer：浮島上有什麼？"
"00:40:30,561 --> 00:40:32,330","What are all these guys jumping off?","這些傢伙都跳下來了？"
"00:40:32,630 --> 00:40:34,866","Penguins? Bagel: Maybe they're loomin' outside the bushes.","企鵝？Bagel：也許牠們在灌木外面若隱若現。"
"00:40:34,866 --> 00:40:37,135","Cambell: You should scan those in. Schafer: Crazy imagination.","Cambell：你應該把那些掃進去。Schafer：想像力真瘋狂。"
"00:40:37,135 --> 00:40:39,037","Bagel: Yep, crazy imagination.","Bagel：對，瘋狂的想像力。"
"00:40:39,037 --> 00:40:42,240","Schafer: Bradbury early folklore-- Mars folklore.","Schafer：Bradbury 早期民俗……火星民俗。"
"00:40:42,240 --> 00:40:44,609","Ooh, I like Mars folklore. Bagel: Mars folklore.","喔，我喜歡火星民俗。Bagel：火星民俗。"
"00:40:44,609 --> 00:40:46,544","Yeah, okay, bros, I'm out of here.","好，兄弟，我走了"
"00:40:46,544 --> 00:40:47,645","Schafer: Aw!","Schafer：喔！"
"00:40:47,645 --> 00:40:50,148","Cambell: What?","Cambell：什麼？"
"00:40:50,148 --> 00:40:52,083","Schafer: Aw, why?","Schafer：為什麼？"
"00:40:52,083 --> 00:40:54,285","Thank you for comin'. Cambell: See you, buddy.","謝謝你過來。Cambell：再見，兄弟。"
"00:40:54,285 --> 00:40:55,687","Bagel: All right.","Bagel：好吧"
"00:40:55,687 --> 00:40:56,988","Bye, bros.","拜拜，兄弟"
"00:40:56,988 --> 00:40:59,691","-All right, buddies. [Offscreen] Bye, Bagel!","-好了，兄弟們。[畫外音] 掰，Bagel！"
"00:40:59,691 --> 00:41:02,493","Chan: Well, I came over to say goodbye.","Chan：我是來道別的"
"00:41:02,493 --> 00:41:04,462","Schafer: Next time, we come up to you.","Schafer：下次我們來找你"
"00:41:04,462 --> 00:41:07,165","Chan: Yeah. Schafer: It's gonna be awesome.","Chan：好啊。Schafer：一定會很棒。"
"00:41:07,165 --> 00:41:08,766","Oh, Jesus.","天啊"
"00:41:10,401 --> 00:41:11,803","Chan: I know.","Chan：我知道"
"00:41:11,803 --> 00:41:23,480","[Laughter] [Music]","[笑聲] [音樂]"
"00:41:24,682 --> 00:41:30,021","Schafer: These are just some, uh, see, Scott is doing some crazy people, which I like.","Schafer：這些只是一些……你看，Scott 畫了一些瘋狂的人物，我很喜歡。"
"00:41:30,021 --> 00:41:33,825","And Lee did some crazy monsters, which I love those, too.","Lee 畫了一些瘋狂的怪物，我也很喜歡。"
"00:41:33,825 --> 00:41:35,526","This guy's too young, that's wrong.","這傢伙太年輕了 不對"
"00:41:35,526 --> 00:41:36,761","I love that one.","我喜歡那個"
"00:41:36,761 --> 00:41:38,663","Those are freaking me out.","嚇死我了"
"00:41:38,663 --> 00:41:41,199","Um, I don't know what that is.","我不知道那是什麼"
"00:41:41,199 --> 00:41:44,202","The Jedi robe.","絕地長袍。"
"00:41:44,202 --> 00:41:45,403","I don't know about the Jedi robe.","絕地長袍我就不確定了。"
"00:41:45,403 --> 00:41:46,671","Some monsters.","一些怪物。"
"00:41:46,671 --> 00:41:48,339","That is a really scary monster.","這怪物真可怕"
"00:41:48,339 --> 00:41:52,777","I think his little--ugh-- little things up front.","我想他前面的小東西"
"00:41:52,777 --> 00:41:59,550","And Bagel did this one and it's like a mountain that looks like a wig.","Bagel 畫了這張，它像一座看起來像假髮的山。"
"00:41:59,550 --> 00:42:01,352","It's like wig mountain.","就像假髮山。"
"00:42:01,352 --> 00:42:03,154","And that's like a ship, I think.","這就像一艘船，我想。"
"00:42:03,154 --> 00:42:04,989","And these are waves floating.","這些是漂浮的海浪"
"00:42:04,989 --> 00:42:07,258","Little mushroom guy, which I love.","我愛的蘑菇小傢伙"
"00:42:07,258 --> 00:42:08,426","I love these paintings.","我喜歡這些畫"
"00:42:08,426 --> 00:42:10,361","They're so tiny.","它們太小了"
"00:42:10,361 --> 00:42:12,196","Sacrificial altars.","獻祭祭壇。"
"00:42:12,196 --> 00:42:17,435","Here's another vision of the girl's village, really happy and cheerful looking, which I like.","這是女孩村莊的另一種想像，看起來非常快樂、開朗，我很喜歡。"
"00:42:17,435 --> 00:42:19,203","This is crazy.","太瘋狂了"
"00:42:19,203 --> 00:42:24,575","It's like a, um... I don't know what that is.","就像是…… 我不知道那是什麼"
"00:42:24,575 --> 00:42:26,411","God's eye, we just had that idea today.","上帝之眼，這是我們今天才想到的點子。"
"00:42:26,411 --> 00:42:28,279","That one's gonna work, I think.","我覺得那個會行得通。"
"00:42:28,279 --> 00:42:31,549","This is such a great stage in the project 'cause everything's been, like, in my head","這是專案中很棒的一個階段，因為之前所有東西都在我的腦袋裡，"
"00:42:31,549 --> 00:42:38,356","and the people's heads and in my notebook, and now it's just exploded out on the wall for everyone to see.","在大家的腦袋裡，也在我的筆記本裡。現在它整個爆發到牆上，讓所有人都看得見。"
"00:42:38,356 --> 00:42:39,757","Everyone.","各位"
"00:42:40,080 --> 00:43:17,580","[Music]","[音樂]"
