"Timecode","Content","Content_zh"
"00:00:21,840 --> 00:00:23,900","Stapley: Yeah, that's pretty. Pretty colors.","Stapley：對，這很漂亮。顏色很美。"
"00:00:27,400 --> 00:00:29,320","Stapley: Yeah, I was looking at the end there.","Stapley：對，我剛剛在看最後那段。"
"00:00:29,980 --> 00:00:33,733","The 20th of September, October, November, December, January, February, March, April.","九月二十日，十月、十一月、十二月、一月、二月、三月、四月。"
"00:00:33,800 --> 00:00:35,800","So yeah, everything looks cool here.","所以對，這邊看起來都不錯。"
"00:00:36,200 --> 00:00:39,760","Yeah, those last three months right there seems like there's going to be a lot of changing.","對，最後那三個月看起來會有很多變動。"
"00:00:39,760 --> 00:00:44,060","[Laughs} From November to February looks a little crazy.","[笑聲] 從十一月到二月看起來有點瘋狂。"
"00:00:47,760 --> 00:00:52,000","Yeah man. It's going to be pretty nuts.","是啊，會很誇張。"
"00:00:52,240 --> 00:01:51,280","[Music] [quite fantasy music]","[音樂] [安靜的奇幻音樂]"
"00:01:53,920 --> 00:01:57,196","Petty: Well, then we need to come up with another plan because right now it's not possible.","Petty：那我們得想另一個計畫，因為現在這樣行不通。"
"00:01:57,200 --> 00:02:04,878","There's just not, one artist can't be the primary, like he's the, he's the, you know, like literally he's the renderer for every object in the game.","就是不可能，一個美術不能當主要負責人，像他就是，呃，等於遊戲裡每個物件都要由他來畫完。"
"00:02:04,880 --> 00:02:07,211","And do concept design on the schedule we have.","還要照我們的時程做概念設計。"
"00:02:07,211 --> 00:02:11,255","Schafer: I think if I hadn't been through the process before, I'd think the project was falling apart last month.","Schafer：我想如果我以前沒經歷過這個流程，我上個月大概會覺得專案快垮了。"
"00:02:11,255 --> 00:02:15,964","It definitely is a little bit of a tension as you switch gears and you're talking about practical matters.","當你要換個方向，開始談實際問題時，確實會有一點緊張。"
"00:02:15,964 --> 00:02:20,345","But it wasn't that tense, you know.","但其實沒有那麼緊張。"
"00:02:20,560 --> 00:02:25,102","Petty: For all the artists involved but certainly for Bagel, we're going to have make, you're going to have decide, I guess,","Petty：對所有參與的美術來說都是，但對 Bagel 特別是，我們得做出，或者說你得決定，"
"00:02:25,120 --> 00:02:29,120","which, what you want the hierarchy of his time to be spent on.","你希望他的時間優先花在哪些事情上。"
"00:02:29,240 --> 00:02:36,042","[Ambient sci-fi music] Schafer: I want him to come up with both the, you know,","[環境科幻音樂] Schafer：我希望他能同時想出，呃，"
"00:02:36,042 --> 00:02:42,750","that really just like content and then actual style, both.","也就是內容，還有實際的風格，兩者都要。"
"00:02:42,750 --> 00:02:45,704","Petty: There's other options there, that we talked about all those options.","Petty：還有其他選項，我們也都談過了。"
"00:02:45,704 --> 00:02:48,724","I don't think we've committed to one particular solution yet.","我不覺得我們已經決定要採用某一個特定方案。"
"00:02:48,724 --> 00:02:52,684","Rice: I think it's an ongoing conversation, so not really.","Rice：我覺得這還在持續討論，所以還沒有。"
"00:03:03,580 --> 00:03:08,768","Schafer: I mean yeah, we're doing, since we're doing a game that's like a different engine type than we've ever done before, it's like 2D.","Schafer：我是說，對，我們現在做的是一款引擎類型跟以前完全不同的遊戲，是 2D 的。"
"00:03:08,768 --> 00:03:16,220","A whole different engine, new devices we'd never worked on and an adventure game, which we would have never made a straight adventure game here at this company.","完全不同的引擎、我們從沒做過的新裝置，還有冒險遊戲。老實說，我們公司本來不會做純冒險遊戲。"
"00:03:16,220 --> 00:03:20,506","So we're doing so many new things with this project that we're just learning.","所以這個專案有太多新東西，我們都還在學。"
"00:03:20,506 --> 00:03:23,867","Every time we try to do something, we find out like that's not going to work.","每次我們試著做一件事，就會發現那樣行不通。"
"00:03:24,160 --> 00:03:27,233","We do have to, of course, correct and try different solutions.","我們當然得修正，再試不同的解法。"
"00:03:28,240 --> 00:03:30,920","But that's totally normal, expected.","但這很正常，也在預期之中。"
"00:03:30,920 --> 00:03:32,960","Offscreen Voice: Don't fuck with my wall.","畫外音：不要亂搞我的牆。"
"00:03:32,960 --> 00:03:37,240","Rice: But I mean, like a lot of it isn't like, there's a problem, we're fucked.","Rice：但我的意思是，很多狀況並不是「出問題了，我們完蛋了」。"
"00:03:37,247 --> 00:03:42,540","It's like we need to pay attention to this and try to start figuring out ways to make it work.","比較像是「我們得注意這件事，開始想辦法讓它可行」。"
"00:03:42,540 --> 00:03:47,323","And we started thinking about that and feeling more comfortable.","我們開始這樣思考之後，也比較安心了。"
"00:03:47,420 --> 00:03:50,927","Schafer: Well, we have, we brought on Levi and he's helping out.","Schafer：嗯，我們找了 Levi 加入，他正在幫忙。"
"00:03:50,940 --> 00:03:55,726","Rice: We have some new people, but like they're getting familiar with everything pretty quickly.","Rice：我們有一些新人，但他們很快就熟悉整個狀況了。"
"00:03:55,726 --> 00:03:58,301","Ryken: I was actually, on Friday I was looking at this.","Ryken：其實我週五有在看這個。"
"00:03:59,400 --> 00:04:00,080","Just getting inspired.","只是想找點靈感。"
"00:04:00,083 --> 00:04:02,383","This is the museum near Tokyo.","這是東京附近的博物館。"
"00:04:03,053 --> 00:04:06,853","It's super cool and I went there and I bought that there.","超酷的，我去過那裡，這個也是在那裡買的。"
"00:04:06,860 --> 00:04:10,916","And for Friday, I just, the first thing in the morning I was getting inspired looking at that.","然後週五一早，我就在看它找靈感。"
"00:04:10,920 --> 00:04:14,120","And then someone was like, you know what?","接著有人就說：「你知道嗎？」"
"00:04:14,120 --> 00:04:20,879","They're playing a bunch of those right now and apparently for like two weeks they're playing all of those studio Ghibli films.","他們現在正在放一堆那個，聽說大概兩週內會放完所有吉卜力工作室的電影。"
"00:04:20,880 --> 00:04:23,180","And I'm just going to be there every day.","所以我每天都會去。"
"00:04:24,774 --> 00:04:26,434","It's happening right now. Yeah.","現在就正在播。對。"
"00:04:26,440 --> 00:04:32,786","Over the weekend I saw three: I saw Nausicaa, which is like a big inspiration for stuff that we're doing right now.","週末我看了三部：我看了《風之谷》，那對我們現在做的東西是很大的靈感來源。"
"00:04:32,786 --> 00:04:34,059","[Offscreen] Yeah we just watched that last week.","[畫外音] 對，我們上週才看過那部。"
"00:04:34,059 --> 00:04:35,619","Really great, it's really great.","真的很棒，真的很棒。"
"00:04:35,620 --> 00:04:38,033","Rice: Yeah. We had like another art slot.","Rice：對。我們還有一個美術名額。"
"00:04:38,040 --> 00:04:43,140","We didn't know what we were going to fill it with and like right now it makes sense","我們本來不知道要找誰來補，但現在看起來很合理，"
"00:04:43,140 --> 00:04:47,240","because concepts the most needed and that's why Levi's around.","因為目前最需要的是概念設計，所以 Levi 才會在這裡。"
"00:04:47,920 --> 00:04:50,148","But I mean, who knows?","不過誰知道呢？"
"00:04:50,148 --> 00:04:56,406","Like later in the project we could be ramping down on concept and need more animation and have to switch it out.","專案後期也許概念需求會降低，反而需要更多動畫，到時候就得調整。"
"00:04:56,406 --> 00:05:02,254","But yeah, we always had one other spot for an artist and I'm glad that it was Levi.","不過對，我們一直都有另一個美術職缺，我很高興最後是 Levi。"
"00:05:02,260 --> 00:05:05,305","Offscreen Voice: How far along did Peter Chan get with his contributions?","畫外音：Peter Chan 的貢獻大概做到什麼程度？"
"00:05:05,420 --> 00:05:06,960","Rice: How far did Peter get?","Rice：Peter 做到哪裡？"
"00:05:09,180 --> 00:05:15,600","I think the last stuff that Peter did was some environment designs for spaceship stuff.","我想 Peter 最後做的是一些太空船相關的環境設計。"
"00:05:16,120 --> 00:05:18,073","Schafer: All right. It's been good talking to you, Peter.","Schafer：好吧。Peter，跟你合作很愉快。"
"00:05:18,080 --> 00:05:22,851","Chan: Thank you again, you guys, for everything and it was a lot of fun.","Chan：也再次謝謝你們的一切，這真的很好玩。"
"00:05:22,906 --> 00:05:24,255","And to be part of it.","能參與其中也很棒。"
"00:05:24,255 --> 00:05:26,001","So thank you for inviting me.","所以謝謝你們邀請我。"
"00:05:26,001 --> 00:05:29,201","Schafer: We'll see you again. Petty: Thanks, Peter.","Schafer：我們會再見的。Petty：謝了，Peter。"
"00:05:29,201 --> 00:05:30,416","Rice: Yeah, it was a bit of a bummer.","Rice：對，這有點可惜。"
"00:05:30,420 --> 00:05:36,493","I mean, he was offsite so it wasn't like we were hanging out all the time, which would have been super fun.","我是說，他是遠端工作，所以我們不是一直能一起混在一起，不然一定會超好玩。"
"00:05:37,080 --> 00:05:41,400","But still, like I did look forward to every Friday, getting like a drop of art from him.","但我還是很期待每個星期五都能收到他交來的一批美術圖。"
"00:05:41,720 --> 00:05:49,424","But Levi's around so like having him right next door and getting to see his stuff, which has been like a totally different take on it and you know,","不過 Levi 就在這裡，讓他坐在隔壁，能看到他的東西，而且那又是完全不同的詮釋，"
"00:05:49,424 --> 00:05:52,230","being able to hang out with him in the office has been fun.","能在辦公室跟他一起相處也很有趣。"
"00:05:52,230 --> 00:05:56,337","Rice: Yeah. I don't know if you talked to Lee much about what you're going to start with, concept-wise.","Rice：對。我不知道你有沒有跟 Lee 多聊過概念上你要先從哪裡開始。"
"00:05:56,340 --> 00:06:00,071","Ryken: Yeah, I have concept stuff for boy world stuff.","Ryken：有，我有一些男孩世界的概念東西。"
"00:06:00,080 --> 00:06:02,840","Rice: Did you check out Peter's? Ryken: Yeah.","Rice：你有看過 Peter 的嗎？Ryken：有。"
"00:06:03,160 --> 00:06:04,820","Rice: Yeah, are you scared?","Rice：對，那你怕了嗎？"
"00:06:05,320 --> 00:06:07,080","It's a lot to live up to, man.","這壓力很大啊。"
"00:06:08,120 --> 00:06:10,260","Ryken: I'll get out my tracing paper.","Ryken：我會把描圖紙拿出來。"
"00:06:11,920 --> 00:06:13,160","Rice: Yeah, I don't think it works that way.","Rice：對，我覺得那樣行不通。"
"00:06:13,160 --> 00:06:18,700","Ryken: Peter Chan did a bunch of the early stuff and I've been looking at what he's been doing.","Ryken：Peter Chan 做了很多早期的東西，我一直在看他做的內容。"
"00:06:20,872 --> 00:06:23,692","This is me, actually look at this.","這是我，真的，你看這個。"
"00:06:24,280 --> 00:06:25,980","That's bootleg P. Chan.","那是盜版 P. Chan。"
"00:06:27,580 --> 00:06:31,680","Schafer: And we have interviewed an intern, an art intern.","Schafer：我們也面試了一位實習生，美術實習生。"
"00:06:31,980 --> 00:06:35,863","I haven't met her yet, but everyone seemed to like her and think she was good.","我還沒見過她，但大家好像都很喜歡她，也覺得她不錯。"
"00:06:35,863 --> 00:06:37,232","And that would help, too.","那也會有幫助。"
"00:06:37,240 --> 00:06:39,821","Offscreen Voice: Oh no, you filmed that!","畫外音：糟了，你拍下來了！"
"00:06:39,821 --> 00:06:43,701","Schafer: Please also join me in welcoming Marius from Germany, where did he go...","Schafer：也請大家一起歡迎來自德國的 Marius，他去哪了……"
"00:06:43,701 --> 00:06:45,700","There he is! Marius Fitz...","在那裡！Marius Fitz……"
"00:06:47,080 --> 00:06:49,358","I'm going to have you pronounce your last name.","我要請你自己念你的姓。"
"00:06:49,360 --> 00:06:50,887","Can you pronounce your last name for us?","可以幫我們念一下你的姓嗎？"
"00:06:51,060 --> 00:06:51,880","Fietzek: Fietzek.","Fietzek：Fietzek。"
"00:06:51,880 --> 00:06:58,788","Schafer: You know, Marius was the one who made an adventure game as a job application for Double Fine, which seems very nice.","Schafer：你們知道，Marius 是那個做了一款冒險遊戲當作 Double Fine 求職作品的人，這真的很棒。"
"00:07:05,660 --> 00:07:15,066","Fietzek: Hey, I heard about the Double Fine Adventure and was super-hyped and yeah, I thought like if I want to,","Fietzek：嘿，我聽說《Double Fine Adventure!》之後超興奮，然後我想，如果我想，"
"00:07:15,066 --> 00:07:23,726","if there's a chance to work with my idols on the 2D animated game, then this is like the only chance maybe ever.","如果有機會跟我的偶像一起做 2D 動畫遊戲，那可能就是這輩子唯一的機會了。"
"00:07:23,726 --> 00:07:30,886","So I made an, application video game.","所以我做了一款求職用的電玩遊戲。"
"00:07:34,360 --> 00:07:39,835","Schafer: Our plan is to actually release that as a Double Fine Adventure and then pocket all the Kickstarter money.","Schafer：我們的計畫是把它真的當成《Double Fine Adventure!》發行，然後把所有 Kickstarter 的錢都收進口袋。"
"00:07:39,840 --> 00:07:41,680","We'll give you a small percentage of it.","我們會分你一小部分。"
"00:07:41,680 --> 00:07:43,622","How long will Marius be here, Mr. Greg Rice?","Greg Rice 先生，Marius 會待多久？"
"00:07:43,960 --> 00:07:44,900","Rice: Three months.","Rice：三個月。"
"00:07:44,900 --> 00:07:46,802","Schafer: You get three months, holy cow.","Schafer：你有三個月，天啊。"
"00:07:46,802 --> 00:07:48,486","And what will he be doing?","那他會做什麼？"
"00:07:48,700 --> 00:07:51,220","Rice: Who knows? Schafer: Who knows.","Rice：誰知道？Schafer：誰知道。"
"00:07:52,200 --> 00:07:55,040","Rice: Animating. Schafer: You'll do some animating on Red's.","Rice：動畫。Schafer：你會幫 Red’s 做一些動畫。"
"00:07:55,040 --> 00:08:02,098","Fietzek: But I started with the whole cinematic approach on the very first cut scene, just to see how it feels.","Fietzek：但我一開始是用很電影化的方式處理第一個過場動畫，只是想看看感覺如何。"
"00:08:02,100 --> 00:08:12,078","I thought of a very quiet start where we first see the spaceship, because I don't, I don't remember a point at the space boy part","我想像一個很安靜的開場，讓我們先看到太空船，因為我不記得太空男孩那部分有哪個時刻，"
"00:08:12,080 --> 00:08:13,591","where we actually see the ship.","是真的看到那艘船的。"
"00:08:13,600 --> 00:08:14,741","Schafer: Well, Marius is great.","Schafer：嗯，Marius 很棒。"
"00:08:14,741 --> 00:08:21,385","Like he's like, he'll just show us, you know, a story board and it's really hard to like how someone do something","他會直接拿故事板給我們看。要跟一個人說「你做的東西真的很棒、很好笑，但也許不太符合我們想法」其實很難。"
"00:08:21,385 --> 00:08:24,981","that's really great and really funny, but just for what you were thinking of it, maybe it's not right.","那真的很棒、很好笑，但就你原本想的方向來說，也許不對。"
"00:08:25,400 --> 00:08:26,629","Schafer: And the same way the girl starts.","Schafer：女孩的開場也是一樣。"
"00:08:26,629 --> 00:08:33,482","She's just laying on the hillside and it's not a cut scene, but like a steady state; you exit out of it by tapping.","她只是躺在山坡上，那不是過場動畫，而是一個靜止的互動畫面；點一下就會離開。"
"00:08:33,482 --> 00:08:34,657","And the same way with this.","這邊也一樣。"
"00:08:34,659 --> 00:08:40,285","It's really got to be that it pans over and shows him and he's laying there on the bed, and the same kind of just, you know.","真的應該是鏡頭平移過去，看到他躺在床上，然後也是那種感覺。"
"00:08:42,820 --> 00:08:46,161","[Schafer] So you got to like tell him, like I had to tell him like this whole sequence was backwards.","[Schafer] 所以你得跟他說，就像我得跟他說，這整段順序是反的。"
"00:08:46,161 --> 00:08:48,221","And he's like, oh great, OK, great.","他就說：「喔太好了，OK，很好。」"
"00:08:48,221 --> 00:08:50,581","And then I come back the next day and it's completely different.","然後我隔天回來，它就完全不一樣了。"
"00:08:50,581 --> 00:08:53,361","Exactly the way I wanted and it's perfect and it's like, oh, that's great.","完全就是我想要的樣子，很完美，我就覺得：「喔，太棒了。」"
"00:08:54,040 --> 00:09:18,369","[Schafer vocalizing sound effects] Schafer: That's awesome.","[Schafer 模仿音效] Schafer：太棒了。"
"00:09:18,400 --> 00:09:23,990","Schafer: You know, it's like, finding someone like that is really, it's hard to find people like that and so you kind of hang onto them.","Schafer：你知道，要找到這樣的人真的很難，所以你會想把他留住。"
"00:09:23,990 --> 00:09:25,563","Of course, he's supposed to go back to school.","當然，他本來應該回去上學。"
"00:09:25,800 --> 00:09:31,560","So then you have to figure out whether you want to derail someone's education by trying to recruit them to come to your company.","所以你接著就得想清楚，要不要為了招募他來公司而打亂別人的學業。"
"00:09:31,560 --> 00:09:32,882","Which of course, I have no problem with.","當然，我完全不介意。"
"00:09:32,882 --> 00:09:38,322","I'm already done thinking about it and I've already thought about it while I was saying that sentence, so, so much for his education.","我已經想完了，而且我在說那句話的時候就已經想完了，所以他的學業就先這樣吧。"
"00:09:38,500 --> 00:09:45,155","[Laughter] Rice: We're finally like fully staffed and we've got like our team,","[笑聲] Rice：我們終於算是人手到齊了，也有自己的團隊了，"
"00:09:45,160 --> 00:09:47,867","all of our budget's totally spent on everyone who's on the team.","我們全部預算都花在團隊成員身上了。"
"00:09:47,867 --> 00:09:56,860","So I think that, you know, a month or so from now it's going to feel like everything's just kind of moving forward steadily and the game is being made.","所以我覺得，大概一個月後，一切應該會開始穩定往前，遊戲也會真的被做出來。"
"00:10:08,620 --> 00:10:12,455","Rice: At the time when we started the Maiden Feast, that was kind of the only puzzle that was far enough along","Rice：當時我們開始做 Maiden Feast 時，那算是唯一進度夠前面的謎題，"
"00:10:12,460 --> 00:10:15,605","that we had enough of a design to actually start building stuff.","我們有足夠的設計內容，可以真的開始製作東西。"
"00:10:15,605 --> 00:10:21,460","So we did know going in that it was like a super kind of meaty puzzle that was going to be a tough one to implement.","所以我們一開始就知道，那是個很有份量的謎題，實作起來會很硬。"
"00:10:21,780 --> 00:10:26,060","And we still, you know, it was kind of all we had to go on at the point.","而且那時候我們也只有那個可以依據。"
"00:10:26,060 --> 00:10:30,868","Schafer: I had the Maiden's Feast designed so they had to like, oh, we got to pick that, 'cause that's the only thing that's really designed.","Schafer：我已經把 Maiden’s Feast 設計好了，所以他們就得選那個，因為那是唯一真正設計好的東西。"
"00:10:30,868 --> 00:10:35,802","Rice: But by the time we'd gotten it to like the first pass kind of state, then we had designs for this Cloud Colony stuff,","Rice：但等我們把它做到第一版狀態時，我們也已經有 Cloud Colony 這些內容的設計，"
"00:10:35,802 --> 00:10:41,282","which we knew was just a lot easier to implement and a lot more indicative of the rest of the game.","而我們知道那個實作起來容易很多，也更能代表遊戲其他部分。"
"00:10:41,520 --> 00:10:49,120","Schafer: So navigation across different layers and pointing and clicking, talking to people, camera motion is all part of Cloud Colony.","Schafer：所以跨不同層級移動、點擊、跟人說話、鏡頭運動，都是 Cloud Colony 的一部分。"
"00:10:49,120 --> 00:10:54,770","Rice: One of the nice things about being able to make those kinds of decisions and jump around is we can like really look at in the moment","Rice：能做這種決定、能在不同部分之間跳來跳去的好處之一，是我們可以真的看當下，"
"00:10:54,770 --> 00:11:04,160","what is most important for the game and be able to kind of like change tracks, without having to like clear that decision with a publisher.","什麼對遊戲最重要，然後轉換方向，不必先拿去給發行商批准。"
"00:11:05,940 --> 00:11:12,405","Schafer: So we kind of left Maiden Feast where it was, which is, you know, has like a stand-in, a couple stand-in pieces of art in there.","Schafer：所以我們把 Maiden Feast 先停在那裡，裡面有一些暫用的美術素材。"
"00:11:13,980 --> 00:11:19,706","Much as it pains me to leave that unfinished, but we'll revisit it soon, I think.","雖然把它留在未完成狀態讓我很痛苦，但我想我們很快會回頭處理。"
"00:11:19,706 --> 00:11:22,766","Schafer: This is a kick-off meeting for the Cloud Colony.","Schafer：這是 Cloud Colony 的啟動會議。"
"00:11:24,600 --> 00:11:28,280","Required reading for this meeting is this document everyone' read, I'm sure.","這次會議的必讀資料是這份文件，我相信大家都看過了。"
"00:11:28,280 --> 00:11:29,719","I've already started working on it.","我已經開始做了。"
"00:11:29,720 --> 00:11:36,241","So I think it's just good to go over all the puzzles in case it exposes things we haven't thought of or just questions you guys have.","所以我想把所有謎題都過一遍是好事，看看會不會暴露出我們沒想到的事，或你們有什麼問題。"
"00:11:36,880 --> 00:11:39,140","Are you ready? Ready to begin?","準備好了嗎？準備開始了嗎？"
"00:11:39,900 --> 00:11:46,440","Schafer: This is the part of the game right after the Maiden's Feast when you get, when you break away and you hitch a ride on that buzzard, on the corset.","Schafer：這是遊戲裡 Maiden’s Feast 之後的部分。你逃出來，搭上那隻禿鷹，掛在束腹上。"
"00:11:46,440 --> 00:11:47,540","And you fly.","然後你飛起來。"
"00:11:48,440 --> 00:11:50,242","It takes you up into the air.","牠會把你帶到空中。"
"00:11:50,242 --> 00:11:57,075","She's the sacrifice girl who's just chosen to run away instead of being sacrificed and feels that she may have just endangered,","她是那個獻祭女孩，她選擇逃跑，而不是被獻祭。她覺得自己可能害了大家，"
"00:11:57,080 --> 00:12:01,441","she's been told that this will endanger her entire town if the monster's not appeased.","因為她被告知，如果沒有安撫怪物，整個村鎮都會有危險。"
"00:12:01,460 --> 00:12:10,018","So now the monster's all upset and she's feeling like I have to do something to get rid of this monster and to protect my family and my town.","所以現在怪物很生氣，她覺得自己必須做點什麼，擺脫這個怪物，保護家人和村鎮。"
"00:12:10,020 --> 00:12:13,458","But before I get back there I'm going to have to like figure out a plan.","但在她回去之前，她得先想出一個計畫。"
"00:12:13,620 --> 00:12:24,689","So she arrives in the home world, if you will, of the bird, which is a little village made of primarily nests that have been,","所以她來到了那隻鳥的「家鄉」，可以這麼說，是一個主要由鳥巢構成的小村莊，"
"00:12:24,689 --> 00:12:28,349","that are buoyant on these really thick clouds, that we're calling the Cloud Colony.","那些鳥巢漂浮在很厚的雲上，我們稱它為 Cloud Colony。"
"00:12:28,460 --> 00:12:38,107","[Music] Schafer: I feel much better because I actually, like I felt good","[音樂] Schafer：我感覺好多了，因為其實，"
"00:12:38,107 --> 00:12:41,867","after I wrote that cloud document, but that was really only like four puzzles.","我寫完那份雲端殖民地設計文件後感覺不錯，但那其實只有大概四個謎題。"
"00:12:41,867 --> 00:12:44,667","And the spaceship one has like sixteen puzzles in there or something.","而太空船那邊有十六個左右的謎題。"
"00:12:44,667 --> 00:12:45,907","So I'm catching up now.","所以我現在正在趕上進度。"
