"Timecode","Content","Content_zh"
"00:12:45,960 --> 00:13:09,880","[Music] Schafer: Aha! Work. I did work.","[音樂] Schafer：啊哈！工作。我有工作。"
"00:13:10,440 --> 00:13:12,240","This is the spec for the whole spaceship.","這是整艘太空船的規格文件。"
"00:13:13,040 --> 00:13:14,660","Designed all the puzzles for the spaceship.","太空船的所有謎題都設計好了。"
"00:13:14,920 --> 00:13:16,140","Offscreen Voice: Really? All the puzzles?","畫外音：真的？所有謎題？"
"00:13:16,620 --> 00:13:19,000","Schafer: Yeah, all the puzzles for the spaceship.","Schafer：對，太空船的所有謎題。"
"00:13:20,060 --> 00:13:25,980","And this is just two-thirds of the puzzles for the girl's world.","而這只是女孩世界三分之二的謎題。"
"00:13:27,580 --> 00:13:31,580","But there's still, I mean, there's still a lot of stuff to design.","不過還有，我是說，還有很多東西要設計。"
"00:13:33,060 --> 00:13:35,500","Schafer: But it's like I have plot points, you know.","Schafer：但我有劇情點，你知道。"
"00:13:35,500 --> 00:13:38,407","I have things where I know I want that to end, Act One.","我知道有些事情要在第一幕結束。"
"00:13:38,407 --> 00:13:40,141","And then that ends Act Two.","然後那邊會結束第二幕。"
"00:13:40,141 --> 00:13:42,250","And then I have these plot points that happen.","然後我有這些會發生的劇情點。"
"00:13:42,250 --> 00:13:49,830","And then to get to that plot point you have to create obstacles and puzzles at the same time, which come out of the story.","接著為了抵達那些劇情點，你必須同時創造障礙和謎題，而它們要從故事裡長出來。"
"00:13:49,830 --> 00:13:51,510","Break out of routine.","打破日常。"
"00:13:53,480 --> 00:13:57,304","Spaceship boy has this routine that he's stuck in every day in space and he has to break out of it.","太空船男孩每天在太空裡被困在同一套日常中，他得打破它。"
"00:13:57,304 --> 00:13:58,304","That's the first puzzle.","那就是第一個謎題。"
"00:13:58,304 --> 00:13:59,269","You do work backwards.","你是倒著做的。"
"00:13:59,269 --> 00:14:02,803","Like you know, it's like you actually aren't designing puzzles.","就像，其實你不是在設計謎題。"
"00:14:02,803 --> 00:14:05,243","You're designing the obstacles in a lot of ways.","很多時候你是在設計障礙。"
"00:14:05,243 --> 00:14:13,101","Like you say, you had a situation in the game where character, you just know there's a plot point where they have to shoot the President.","比方說，遊戲裡有個情境，你知道有個劇情點是角色必須射殺總統。"
"00:14:13,360 --> 00:14:16,162","And so, I don't have any plans to shoot the President.","先說，我沒有任何射殺總統的計畫。"
"00:14:16,162 --> 00:14:18,422","So, but anyways, say that was a puzzle in the game.","但總之，假設那是遊戲裡的一個謎題。"
"00:14:18,422 --> 00:14:19,961","The President's really bad.","總統真的很壞。"
"00:14:20,160 --> 00:14:21,238","You got to shoot the President.","你得射殺總統。"
"00:14:21,240 --> 00:14:26,673","You know, I work backwards, so some cool wish fulfillment, like OK, he's going to be, he's sneaking into the White House.","你知道，我會倒著推，所以那是某種很酷的願望實現。好，他要偷偷溜進白宮。"
"00:14:26,680 --> 00:14:27,823","How would you sneak into White House?","你要怎麼溜進白宮？"
"00:14:27,823 --> 00:14:30,813","You could wear a mask that made you look like a visiting ambassador.","你可以戴一個面具，讓自己看起來像來訪的大使。"
"00:14:30,820 --> 00:14:33,483","Like how do you make a plaster cast of his face to make the mask?","那你要怎麼用他的臉做石膏模型來做面具？"
"00:14:33,483 --> 00:14:36,343","Then maybe it's to trick him into tripping and falling in cement.","也許方法是騙他絆倒，臉摔進水泥裡。"
"00:14:36,343 --> 00:14:39,102","And then at each point you think, OK, was that an actual revelation?","然後每一步你都會想，OK，這有帶來真正的發現嗎？"
"00:14:39,102 --> 00:14:43,562","Like you don't want to have, it just be a series of tedious chores.","你不希望它只是一連串乏味的雜事。"
"00:14:43,562 --> 00:14:47,663","It's got to be like oh, I have a really clear problem that I need to solve.","它必須是「喔，我有一個很明確、需要解決的問題」。"
"00:14:47,663 --> 00:14:52,023","Like the three most obvious ways to solve it don't work.","然後三個最直覺的解法都行不通。"
"00:14:52,320 --> 00:14:57,061","And the game anticipates that and like has a great response for when you try to execute that solution.","遊戲要預判玩家會那樣做，並在玩家嘗試那個解法時給出很棒的回應。"
"00:14:57,061 --> 00:14:58,912","You put a little like, aha!","你放一點像是：「啊哈！」"
"00:14:59,180 --> 00:15:00,745","Good try, no.","「不錯，但不行。」"
"00:15:00,745 --> 00:15:02,565","But did you think about this?","「不過你有想過這個嗎？」"
"00:15:02,565 --> 00:15:07,211","And that little nudge is like, oh, you know, kind of, like doesn't give you the answer","那個小提示就像：「喔，你知道，」它不會直接把答案給你，"
"00:15:07,220 --> 00:15:10,900","but kind of points you back towards the ballpark where the answer is.","但會把你指回答案所在的大致範圍。"
"00:15:11,400 --> 00:15:12,681","Schafer: This is the first puzzle.","Schafer：這是第一個謎題。"
"00:15:12,681 --> 00:15:16,401","So the puzzle is that you open this a little bit.","謎題是你把這個打開一點。"
"00:15:18,220 --> 00:15:21,176","And then you try to go to it, it closes.","然後你試著過去，它就關起來。"
"00:15:21,509 --> 00:15:28,269","And then there's some really counterintuitive, almost opposite of normal way of thinking that makes you realize, ah!","接著會有某個非常違反直覺、幾乎跟正常思考相反的東西，讓你意識到：「啊！」"
"00:15:28,540 --> 00:15:30,714","If I did this really weird thing, that would actually work.","如果我做這件很奇怪的事，反而真的會成功。"
"00:15:30,720 --> 00:15:37,140","The thing you had to do with the lock is take the lock and actually lock the gate shut.","你要對那把鎖做的事，是拿鎖把門鎖死。"
"00:15:43,060 --> 00:15:47,380","So now when you try to pull the chain, it can't pull the gate up and instead...","所以現在你拉鍊子的時候，它拉不起門，反而……"
"00:15:58,840 --> 00:16:02,546","'Cause then the player's like, oh, I'm so smart, you know.","因為這樣玩家就會覺得：「喔，我真聰明。」"
"00:16:02,546 --> 00:16:03,566","I figured it out.","我解出來了。"
"00:16:11,520 --> 00:16:15,400","Now that a lot of stuff is designed ahead of those guys and they're able to look at it and work on it.","現在很多東西都已經先設計好，他們可以看著那些內容開始做。"
"00:16:15,880 --> 00:16:18,267","That always relieves a little bit of tension.","這總是能稍微減輕一點壓力。"
"00:16:18,420 --> 00:16:22,524","Rice: Tim has filled in, it looks like boy world and I think he's even put more girl world stuff in.","Rice：Tim 已經補上了，看起來像是男孩世界，我想他甚至又放了更多女孩世界的東西進去。"
"00:16:22,524 --> 00:16:24,104","Have you even looked at this, really, Levi?","Levi，你真的看過這個嗎？"
"00:16:24,104 --> 00:16:25,552","Ryken: This is all Tim does?","Ryken：這全都是 Tim 做的？"
"00:16:25,560 --> 00:16:28,586","I thought he was supposed to be writing things, not just writing little things on Post-its.","我以為他應該要寫東西，不只是把小東西寫在便利貼上。"
"00:16:28,586 --> 00:16:29,926","Rice: Yeah, he's writing the whole game on little Post-its.","Rice：對，他正在用小便利貼寫整個遊戲。"
"00:16:29,926 --> 00:16:30,926","Ryken: Oh, OK.","Ryken：喔，OK。"
"00:16:31,840 --> 00:16:35,100","Rice: There wasn't much there before, so it's nice to see that it's filled out.","Rice：之前那裡沒什麼內容，所以看到它被補起來感覺很好。"
"00:16:35,400 --> 00:16:38,908","Rice: It's definitely unique and different than anything he's designed or written before.","Rice：這絕對很獨特，跟他以前設計或寫過的任何東西都不一樣。"
"00:16:39,040 --> 00:16:44,260","So I think it's cool to see that he's trying something different and kind of going out on a limb a little bit.","所以我覺得看到他嘗試不同的東西、稍微冒點險，滿酷的。"
"00:16:45,000 --> 00:16:47,685","I haven't seen any writing yet, so I don't know what that's going to be like.","我還沒看到任何劇本，所以不知道會是什麼樣子。"
"00:16:47,685 --> 00:16:52,121","Because it does seem like this game has a much more serious tone than his other games have,","因為這款遊戲的調性確實看起來比他的其他遊戲嚴肅很多，"
"00:16:52,360 --> 00:16:56,464","but I'm excited to get to that point where I start seeing Tim's writing, because I'm sure it'll be awesome.","但我很期待看到 Tim 寫出來的內容，因為我相信一定會很棒。"
"00:16:56,780 --> 00:16:59,420","Rice: So far this is in the game.","Rice：目前這些已經在遊戲裡了。"
"00:16:59,680 --> 00:17:01,060","This is all in the game.","這些都在遊戲裡。"
"00:17:01,580 --> 00:17:02,919","It looks like this.","看起來是這樣。"
"00:17:02,920 --> 00:17:04,460","This is all in the game.","這些都在遊戲裡。"
"00:17:04,740 --> 00:17:07,800","And now we're going to be starting on some of this stuff.","然後我們現在要開始做這些東西。"
"00:17:08,819 --> 00:17:12,719","Rice: And we have an approved girl, so that's exciting.","Rice：而且我們的女孩已經核准了，所以很令人興奮。"
"00:17:13,099 --> 00:17:14,284","Petty: So let's see.","Petty：那我們來看看。"
"00:17:14,319 --> 00:17:16,439","So let's look at the suicide girl. So she's got...","我們來看這個自殺女孩。她有……"
"00:17:16,440 --> 00:17:17,922","Schafer: See, you call her suicide girl, too.","Schafer：你看，你也叫她自殺女孩。"
"00:17:17,922 --> 00:17:19,462","Petty: Yeah. Schafer: It's sacrifice girl.","Petty：對。Schafer：她是獻祭女孩。"
"00:17:19,462 --> 00:17:20,402","Petty: I know it is.","Petty：我知道。"
"00:17:21,000 --> 00:17:23,120","So which of these dresses do you like the most?","所以這幾件洋裝你最喜歡哪一件？"
"00:17:26,599 --> 00:17:30,113","Schafer: My favorite one is that one, but I like the original one.","Schafer：我最喜歡那件，但我也喜歡原本那件。"
"00:17:30,120 --> 00:17:31,707","I like that one, too.","我也喜歡那件。"
"00:17:31,707 --> 00:17:34,087","Schafer: So I just put them in front of my daughter and let her pick.","Schafer：所以我就把它們放到我女兒面前，讓她選。"
"00:17:34,340 --> 00:17:35,860","That solved the whole problem.","這就解決整個問題了。"
"00:17:36,800 --> 00:17:39,202","Schafer: These are the princesses from papa's new game.","Schafer：這些是爸爸新遊戲裡的公主。"
"00:17:39,202 --> 00:17:40,202","Schafer: I call them princesses.","Schafer：我叫她們公主。"
"00:17:40,202 --> 00:17:41,322","Which one do you like best?","你最喜歡哪一個？"
"00:17:42,920 --> 00:17:43,800","Think really hard.","認真想喔。"
"00:17:48,480 --> 00:17:49,620","Why do you like em?","你為什麼喜歡她？"
"00:17:50,540 --> 00:17:52,060","Daughter: Because she's so beautiful.","女兒：因為她好漂亮。"
"00:17:58,580 --> 00:17:59,751","Rice: And she's looking good.","Rice：她看起來不錯。"
"00:17:59,760 --> 00:18:00,720","We just got her in the game.","我們剛把她放進遊戲裡。"
"00:18:00,720 --> 00:18:01,820","She's walking around and everything.","她已經會走來走去了。"
"00:18:02,220 --> 00:18:03,441","The boy's getting there.","男孩也快好了。"
"00:18:03,441 --> 00:18:05,261","We've done like two rounds on him.","我們已經做了兩輪。"
"00:18:05,460 --> 00:18:07,660","Schafer: Scott's been working on characters in the morning.","Schafer：Scott 早上一直在做角色。"
"00:18:07,660 --> 00:18:14,024","He's been kind of splitting his time with a book that he's working on, an art show or one of the zillion things that he does.","他一直把時間分給他正在做的書、藝術展，或他做的無數事情之一。"
"00:18:14,024 --> 00:18:15,410","He's very busy.","他非常忙。"
"00:18:15,410 --> 00:18:22,431","Campbell: So it's an ongoing kind of, kind of project and this is the culmination of it.","Campbell：所以這是一個持續進行的專案，而這是它的成果。"
"00:18:22,440 --> 00:18:26,496","Culmination of like a year, you know, like a year and a half's worth right now.","算是一年，大概一年半累積到現在的成果。"
"00:18:26,500 --> 00:18:29,060","And then we have a book coming out, so that's what we're doing, so.","然後我們還有一本書要出版，所以這就是我們在做的事。"
"00:18:29,660 --> 00:18:33,243","Schafer: He's drawn some of the sacrifice girl and spaceship boy.","Schafer：他畫了一些獻祭女孩和太空船男孩。"
"00:18:33,243 --> 00:18:35,658","He's been drawing some of the Cloud Colony people.","他也畫了一些 Cloud Colony 的居民。"
"00:18:36,060 --> 00:18:38,254","And I'm supposed to look at those, right.","而我應該要去看那些，對吧。"
"00:18:38,260 --> 00:18:39,760","I've got to give him feedback on those.","我得給他那些圖的回饋。"
"00:18:39,960 --> 00:18:41,036","Schafer: I do like that guy, too.","Schafer：我也喜歡那個傢伙。"
"00:18:41,040 --> 00:18:42,940","But then again he is doing a cool pose.","不過話說回來，他的姿勢確實很酷。"
"00:18:43,420 --> 00:18:44,843","Campbell: And it's going great, man.","Campbell：一切進展得很順利，老兄。"
"00:18:44,843 --> 00:18:45,947","It's looking really good.","看起來真的很不錯。"
"00:18:45,947 --> 00:18:51,547","I definitely feel that like relaxation of like knowing that like these designs, even if they're a little unfinished,","我確實有種放鬆的感覺，知道這些設計就算還有點未完成，"
"00:18:51,547 --> 00:18:56,280","I know they're going to go to Bagel and he's going to make them like, fucking make 'em Bagel-style.","我知道它們會交到 Bagel 手上，他會把它們做成那種，該死的 Bagel 風格。"
"00:18:56,280 --> 00:18:57,860","Dude, I just swore again.","老兄，我又罵髒話了。"
"00:18:57,860 --> 00:19:01,080","I mean, I thought for sure I wasn't going to swear in these things.","我是說，我本來很確定自己不會在這些訪談裡罵髒話。"
"00:19:01,600 --> 00:19:02,888","I'm mellowing out, dude.","老兄，我變溫和了。"
"00:19:02,888 --> 00:19:04,125","But yeah, he's doing great.","不過對，他做得很好。"
"00:19:04,125 --> 00:19:05,745","He has a lot of work ahead of him, though.","但他接下來還有很多工作。"
"00:19:05,745 --> 00:19:09,280","He's stressed about it, but Bagel's the kind of guy, he's like just this kind of chill dude, you know.","他對這件事有壓力，但 Bagel 是那種人，他就是很 chill 的傢伙，你知道。"
"00:19:09,280 --> 00:19:10,868","He's like, I know.","他會說：「我知道。」"
"00:19:10,868 --> 00:19:14,676","He's like, I'm going to, he's like, I'm going to have a lot of work ahead of me, but ah.","他會說：「我接下來會有很多工作要做，不過，啊。」"
"00:19:14,680 --> 00:19:19,316","'Cause it's like it's all fun stuff, you know, he's doing what he loves, which is like painting that stuff, you know.","因為那些都是有趣的事，你知道，他在做自己喜歡的事，也就是畫那些東西。"
"00:19:19,320 --> 00:19:27,408","And he's definitely, he's definitely feeling kind of nervous, but I'm so excited for it to be his, his look, so yeah.","他確實有點緊張，但我非常期待最後呈現出他的風格。對。"
"00:19:40,240 --> 00:19:42,617","Offscreen Voice: So Bagel's in the studio this week? Rice: Yeah.","畫外音：所以 Bagel 這週在工作室？Rice：對。"
"00:19:42,620 --> 00:19:45,860","Bagel's in my house this week. Offscreen Voice: Perfect.","Bagel 這週住我家。畫外音：完美。"
"00:19:46,120 --> 00:19:49,108","Rice: He had to take Marius's spot from the couch.","Rice：他只好從沙發上佔走 Marius 的位置。"
"00:19:49,108 --> 00:19:50,728","So Marius got kicked out.","所以 Marius 被踢出去了。"
"00:19:52,360 --> 00:19:54,460","I'm like running a hostel right now.","我現在簡直像在經營青年旅館。"
"00:19:54,900 --> 00:19:56,080","Stapley: Yeah, it's weird.","Stapley：對，很怪。"
"00:19:56,880 --> 00:19:58,860","There's a lot of farting going on.","到處都有人放屁。"
"00:20:00,060 --> 00:20:02,980","He has these weird nerdy glasses that he wears at night.","他晚上會戴那種很怪的宅宅眼鏡。"
"00:20:03,460 --> 00:20:05,200","Schafer: Why is Bagel in the office this week?","Schafer：Bagel 這週為什麼在辦公室？"
"00:20:05,200 --> 00:20:06,420","I don't know.","我不知道。"
"00:20:06,780 --> 00:20:08,640","Hi guys.","嗨，各位。"
"00:20:08,640 --> 00:20:10,900","Schafer: Hi, oh my god you look so real.","Schafer：嗨，天啊，你看起來好真實。"
"00:20:11,660 --> 00:20:13,360","Lee: He's come out of the camera!","Lee：他從攝影機裡出來了！"
"00:20:13,360 --> 00:20:15,140","Schafer: The microphone is working so well today.","Schafer：今天麥克風效果真好。"
"00:20:15,140 --> 00:20:16,800","Bagel: My microphone is awesome!","Bagel：我的麥克風超棒！"
"00:20:16,800 --> 00:20:18,520","Crook: Now we can't turn you down.","Crook：現在我們沒辦法把你音量調低了。"
"00:20:18,700 --> 00:20:24,785","Schafer: Lee was starting some new processes with art production, like trying to get Bagel to be pretty independent","Schafer：Lee 開始為美術製作建立一些新的流程，像是讓 Bagel 能更獨立，"
"00:20:24,785 --> 00:20:27,844","where he could just paint actual art for the game right into the engines.","讓他可以直接把遊戲真正要用的美術畫進引擎裡。"
"00:20:27,844 --> 00:20:33,386","So getting that set up was really hard to do over Skype or Google Hang Outs, like we do.","所以要把那套流程架起來，透過 Skype 或 Google Hangouts 真的很難，雖然我們就是這樣做。"
"00:20:33,480 --> 00:20:37,280","We don't always have the smoothest conversations over that, I don't know if you noticed.","我們透過那些工具對話時不總是很順，不知道你有沒有注意到。"
"00:20:37,520 --> 00:20:41,192","Stapley: [inaudible] Petty: I think we're going to do it tomorrow.","Stapley：[聽不清楚] Petty：我想我們明天會做。"
"00:20:41,520 --> 00:20:45,358","Stapley: [inaudible] Petty: What's that?","Stapley：[聽不清楚] Petty：什麼？"
"00:20:45,462 --> 00:20:48,900","Stapley: [inaudible] Petty: I'm sorry, I can't make it out, dude.","Stapley：[聽不清楚] Petty：抱歉，老兄，我聽不出來。"
"00:20:49,280 --> 00:20:54,180","Stapley: [inaudible] [Laughing]","Stapley：[聽不清楚] [笑聲]"
"00:20:54,240 --> 00:20:57,724","Stapley: But it is good to kind of sit right with them, you know.","Stapley：但能跟他們坐在一起其實滿好的，你知道。"
"00:20:57,920 --> 00:21:06,243","Crook: Yeah, I think this texture, the painting style goes really well with this sort of weird... Stapley: Brush stroke.","Crook：對，我覺得這個材質、這種繪畫風格，跟這種奇怪的……Stapley：筆觸。"
"00:21:06,243 --> 00:21:07,274","Crook: the way we're animating it.","Crook：跟我們做動畫的方式很搭。"
"00:21:07,280 --> 00:21:08,660","I think it goes really well with it.","我覺得真的很搭。"
"00:21:08,860 --> 00:21:10,133","I think it's cool.","我覺得很酷。"
"00:21:10,360 --> 00:21:15,142","Stapley: But yeah, there are some things that are easier just to talk to, like walk over to Lee and talk to him, I think.","Stapley：不過對，有些事情就是當面講比較容易，像是直接走去找 Lee 說。"
"00:21:15,142 --> 00:21:18,393","I've already done that like three times today, which is pretty nice.","我今天已經這樣做三次了，感覺滿好的。"
"00:21:18,420 --> 00:21:22,313","Rice: And here like with such a small art team, like it's going to be really important that he's not only painting stuff","Rice：而且在這麼小的美術團隊裡，很重要的是他不只要畫東西，"
"00:21:22,320 --> 00:21:29,240","but like making sure it gets into the game right and looks good and he's viewing it in the game and seeing how that changes.","還要確保東西正確放進遊戲、看起來好，而且他能在遊戲裡看它，看到它會怎麼變化。"
"00:21:29,460 --> 00:21:32,700","Petty: So like Brandon spent a lot of time making sure that all the tools he was writing","Petty：所以 Brandon 花了很多時間確保他寫的所有工具，"
"00:21:32,700 --> 00:21:37,320","were going to help Bagel and make sure that that was a really smooth process.","都能幫到 Bagel，並確保整個流程非常順。"
"00:21:38,860 --> 00:21:46,610","Brandon: The main thing that I've been working is enhancements to our scene editor so that the tool works a little bit more like Photoshop","Brandon：我主要在做的是強化我們的場景編輯器，讓這個工具用起來更像 Photoshop，"
"00:21:46,610 --> 00:21:49,603","in terms of being able to hide and show the layers that you're working on.","也就是能隱藏或顯示你正在處理的圖層。"
"00:21:49,603 --> 00:21:54,622","I got the Nav meshes in there so that instead of just editing these in text files you can actually,","我也把 Nav mesh 放進去了，這樣你不必只在文字檔裡編輯這些東西，"
"00:21:54,622 --> 00:21:59,422","you know, individually kind of lay out the geometry for the walkable areas.","你可以個別配置可行走區域的幾何形狀。"
"00:21:59,860 --> 00:22:04,883","Just really trying to flesh the stuff out so that the workflow for artists is a lot smoother.","就是盡量把這些東西補完整，讓美術的工作流程順很多。"
"00:22:04,883 --> 00:22:10,064","Rice: And it's almost there so I think that's the, that's the idea, is to try to get him comfortable with that process.","Rice：已經快完成了，所以我想重點就是讓他熟悉這個流程。"
"00:22:10,640 --> 00:22:12,980","Stapley: Yeah, so you can see...","Stapley：對，所以你可以看到……"
"00:22:18,384 --> 00:22:19,824","Right. Right, right.","對。對，對。"
"00:22:20,580 --> 00:22:22,660","Still totally getting used to this shit.","我還在完全適應這玩意兒。"
"00:22:22,740 --> 00:22:52,350","[Music] Stapley: Hey, bros. What's up?","[音樂] Stapley：嘿，兄弟們。怎樣？"
"00:22:52,350 --> 00:22:54,050","How's it going, fellows?","各位最近如何？"
"00:22:55,640 --> 00:22:56,840","Offscreen Voice: So, has this been coming along?","畫外音：所以，這個進展如何？"
"00:22:56,900 --> 00:22:58,482","Stapley: Oh, it's almost done, it's almost done.","Stapley：喔，快完成了，快完成了。"
"00:22:58,667 --> 00:22:59,827","No, I'm just kidding.","沒有啦，我開玩笑的。"
"00:23:00,180 --> 00:23:01,538","It's not done at all.","根本還沒完成。"
"00:23:01,760 --> 00:23:03,700","I'm going to give up on it and come back to it later.","我打算先放棄它，晚點再回來做。"
"00:23:05,180 --> 00:23:11,188","And there's a bunch of other shit to do and I like don't have any fresh eyes on it anymore, you know.","而且還有一堆其他鳥事要做，我已經沒有新鮮眼光可以看它了，你知道。"
"00:23:11,980 --> 00:23:14,860","I've just been looking at the same thing for like a week and I'm over it.","我已經看同一個東西看了一個禮拜，膩了。"
"00:23:15,980 --> 00:23:20,140","I'm going to just work on it until stand-ups and then Tim's going to check it out.","我會一直做到站會，然後 Tim 會來看。"
"00:23:20,320 --> 00:23:22,380","Petty: In terms of like how good the readability is.","Petty：就可讀性有多好來說。"
"00:23:22,380 --> 00:23:28,278","If it's feeling right to you, you know, story, theme-wise and all that, before he digs into some of the other areas.","在他深入其他區域之前，要看你覺得感覺對不對，故事、主題之類的。"
"00:23:28,280 --> 00:23:31,404","And then you know, like there's a lot of, like because that Cloud Colony...","然後你知道，因為 Cloud Colony 有很多……"
"00:23:31,404 --> 00:23:34,660","Schafer: I can see how the world's going to look pretty and how it's going to all look like it's one cohesive thing,","Schafer：我看得出這個世界會很漂亮，也會看起來像一個有凝聚力的整體，"
"00:23:34,660 --> 00:23:44,688","but the secret thing that I'm hoping for is still, we have some of the, Bagel's ideas that only he would come up with for the landscape.","但我暗自希望的還是，我們能保留一些 Bagel 對地景的想法，那些只有他才會想到的東西。"
"00:23:45,360 --> 00:23:46,620","Kind of bizarre.","有點怪誕。"
"00:23:47,160 --> 00:23:48,700","He doesn't have those in there yet.","他還沒把那些放進去。"
"00:23:49,100 --> 00:23:52,860","Stapley: Yeah, this was Peter's, Peter's concept ideas.","Stapley：對，這是 Peter 的，Peter 的概念想法。"
