"Timecode","Content","Content_zh"
"00:23:53,765 --> 00:23:55,105","Lee's layout.","Lee 的配置。"
"00:23:56,000 --> 00:23:57,341","Would I do a painting of this?","我會畫這個嗎？"
"00:23:57,341 --> 00:23:58,201","I'm not sure.","我不確定。"
"00:23:58,980 --> 00:24:00,260","I don't know if I would.","我不知道自己會不會。"
"00:24:00,540 --> 00:24:03,740","But like I'm doing a painting of it now.","但我現在正在畫它。"
"00:24:05,520 --> 00:24:06,880","OK, man.","OK，老兄。"
"00:24:06,880 --> 00:24:08,918","I'm wondering about that Bagel filter thing.","我在想那個 Bagel 濾鏡的事。"
"00:24:08,920 --> 00:24:12,140","I'm just wondering what it is, you know.","我只是想知道那到底是什麼，你知道。"
"00:24:13,960 --> 00:24:15,260","What if Tim's happy with it.","如果 Tim 滿意呢？"
"00:24:15,260 --> 00:24:16,280","I should talk to Tim.","我應該跟 Tim 談談。"
"00:24:18,120 --> 00:24:19,520","Schafer: I have not talked to him about that.","Schafer：我還沒跟他談過那件事。"
"00:24:19,520 --> 00:24:22,000","I haven't talked to him on this trip about how he's feeling about everything.","這趟他來，我還沒跟他談過他對整件事的感受。"
"00:24:22,000 --> 00:24:23,440","That'll be interesting.","那應該會很有意思。"
"00:24:23,440 --> 00:24:26,438","Hopefully we get some alone time.","希望我們能有點單獨相處的時間。"
"00:24:26,440 --> 00:24:27,780","Petty: I just don't know about the painting Bagel.","Petty：我只是不太確定 Bagel 繪畫這件事。"
"00:24:27,780 --> 00:24:29,600","Now how are you feeling about the like...","那你現在對這個感覺怎麼樣……"
"00:24:29,600 --> 00:24:33,300","We've been going back and forth a long time just trying to get a feel for that whole process.","我們來來回回很久了，只是想掌握整個流程的感覺。"
"00:24:33,580 --> 00:24:35,137","Stapley: The paining process? Petty: Yeah.","Stapley：繪畫流程？Petty：對。"
"00:24:35,140 --> 00:24:37,904","And then like work on this big ass fucking layered files and...","然後還要處理這些超大的該死分層檔案，然後……"
"00:24:37,904 --> 00:24:40,029","Stapley: Yeah, yeah. I'm comfortable with that.","Stapley：對，對。那部分我沒問題。"
"00:24:40,029 --> 00:24:43,840","I'd like to actually get involved more with like the concept stuff, though.","不過我其實想更參與概念方面的東西。"
"00:24:43,840 --> 00:24:44,420","Petty: Yeah?","Petty：是嗎？"
"00:24:44,420 --> 00:24:46,842","Stapley: I feel like I'm just kind of a painter.","Stapley：我覺得自己好像只是個畫工。"
"00:24:46,842 --> 00:24:52,988","I just feel like people are expecting it to be mine somehow, you know, just 'cause, you know.","我只是覺得大家好像期待它某種程度上是我的東西，你知道，只因為，呃，你知道。"
"00:24:53,960 --> 00:24:55,820","That's what people are saying.","大家都這樣說。"
"00:24:56,580 --> 00:24:58,659","And like it's supposed to be my style but it isn't really.","而且它應該是我的風格，但其實不是。"
"00:24:58,720 --> 00:25:01,790","Petty: It may be that you're feeling like the painting isn't the side that you care about most.","Petty：也許你覺得繪畫不是你最在乎的那一面。"
"00:25:01,790 --> 00:25:07,167","Maybe you feel more about the shape, language and the concept design and we, you know, Levi does painting and you do layouts.","也許你更在乎造型語言和概念設計，而我們可以，呃，Levi 做繪畫，你做配置。"
"00:25:07,167 --> 00:25:09,467","There's flexibility there.","這中間有彈性。"
"00:25:09,700 --> 00:25:14,502","Stapley: Where like I don't paint everything but be kind of like overlook, you know.","Stapley：像是我不畫所有東西，而是比較像監督，你知道。"
"00:25:14,940 --> 00:25:17,820","Kind of just try to keep everything together.","就是盡量把整體維持在一起。"
"00:25:18,300 --> 00:25:21,180","And that way I'm able to do some more idea stuff.","那樣我就能做更多點子方面的事情。"
"00:25:22,580 --> 00:25:26,739","'Cause even now the way it's going, like I don't think, I mean, like even this way","因為就算照現在這樣走，我也不覺得，我是說，就算這樣，"
"00:25:26,740 --> 00:25:30,211","I don't think I'd be able to do all these paintings in four months.","我也不覺得我能在四個月內完成所有這些畫。"
"00:25:30,220 --> 00:25:33,580","Seventy paintings by myself, anyway, you know.","反正七十張畫，不可能我一個人全畫完。"
"00:25:34,220 --> 00:25:43,592","Well, at least if we're going to say like this is Bagel's style game, then I would, yeah, at least I would have a little bit more like yeah,","嗯，至少如果我們要說這是 Bagel 風格的遊戲，那我至少會比較能覺得，"
"00:25:43,600 --> 00:25:46,579","you know, that is my stuff. You know.","你知道，那是我的東西。"
"00:25:46,580 --> 00:25:51,860","Instead of like, ah, it's like an awesome Peter Chan drawing or something, you know, that I colored.","而不是「啊，這是一張很棒的 Peter Chan 畫作之類的，只是我幫它上色」。"
"00:25:52,400 --> 00:25:58,178","Why don't we like finish off this sprint until the end of the month, right.","不如我們先把這個 sprint 做到月底，對吧。"
"00:25:58,180 --> 00:26:00,665","I'll try to get all this cloud things going.","我會試著把這些雲端的東西都推起來。"
"00:26:00,665 --> 00:26:05,776","Petty: But I think it's a tougher thing where that if we come up with a sketch of a plan that we think might work,","Petty：但我覺得比較難的是，如果我們想出一個覺得可能可行的粗略計畫，"
"00:26:05,780 --> 00:26:08,782","then I think we should try it sooner than later, 'cause fuck a sprint.","那我覺得我們應該越早試越好，管他什麼 sprint。"
"00:26:08,782 --> 00:26:10,066","Who cares? I don't care.","誰在乎？我不在乎。"
"00:26:10,066 --> 00:26:11,666","There's no publisher fucking us in the ass over it.","又沒有發行商為了這件事把我們往死裡逼。"
"00:26:11,666 --> 00:26:17,029","Like with just the whole point is, it's just there to like be milestones as we make this game, right?","整個重點只是，它就是在我們做遊戲時作為里程碑，對吧？"
"00:26:17,512 --> 00:26:23,404","So if we, you know, as long we're meeting Tim's goals for the project, as long as we think we can actually get it done","所以只要我們能達成 Tim 對專案的目標，只要我們覺得真的做得完，"
"00:26:23,404 --> 00:26:29,104","and as long as we're all willing to give it a shot, there's no reason in the world we shouldn't be flexible. Right.","也只要大家都願意試試看，就完全沒有理由不保持彈性。對吧。"
"00:26:29,620 --> 00:26:34,960","Stapley: I think it was because really when it first started, it was going to be like $300,000","Stapley：我想是因為一開始真的只是要做三十萬美元左右，"
"00:26:34,960 --> 00:26:40,680","and we're going to just try to do some retro Day of the Tentacle shit, you know.","然後我們只是想做一些復古的《Day of the Tentacle》那種東西，你知道。"
"00:26:41,400 --> 00:26:45,020","And I know things change so much from the beginning of this Kickstarter thing, you know.","我也知道從這個 Kickstarter 開始以來，事情已經變了很多，你知道。"
"00:26:45,020 --> 00:26:49,187","And I know now it's huge, it's a big thing, which is great.","我也知道它現在很大，是個大東西，這很好。"
"00:26:49,187 --> 00:26:50,785","And it's awesome.","而且很棒。"
"00:26:51,060 --> 00:26:55,260","But, I think we can work it out somehow.","不過我覺得我們可以想辦法解決。"
"00:26:56,440 --> 00:27:01,244","Schafer: You know, right now Bagel's been doing a lot of painting, which is not necessarily, I can see where that would feel like,","Schafer：你知道，Bagel 現在一直在畫很多圖，雖然不一定，但我可以理解那種感覺，"
"00:27:01,244 --> 00:27:05,079","you're just like doing a coloring book or paint-by-numbers.","你會覺得自己只是在做著色本，或照號碼上色。"
"00:27:05,080 --> 00:27:06,780","Those are just my terms, not his.","那只是我的說法，不是他的。"
"00:27:07,940 --> 00:27:08,837","Stapley: I don't know.","Stapley：我不知道。"
"00:27:08,840 --> 00:27:09,940","I don't even know how it's going to turn out.","我甚至不知道最後會變成怎樣。"
"00:27:09,940 --> 00:27:12,740","It might turn out totally different.","也許結果會完全不同。"
"00:27:13,900 --> 00:27:16,960","I'm just kind of glad I got it off my chest, that's all.","我只是有點高興自己把話說出來了，就這樣。"
"00:27:17,780 --> 00:27:21,820","Schafer: Yeah, I think his coming out here in person is what allowed him to open up about that.","Schafer：對，我覺得他親自來這裡，才讓他能開口談那件事。"
"00:27:21,820 --> 00:27:22,832","I think he's over Skype.","我想如果是透過 Skype，"
"00:27:22,840 --> 00:27:26,220","It's hard to really talk about, how you're feeling.","要真的談自己的感受是很難的。"
"00:27:27,400 --> 00:27:30,420","Stapley: I'm glad I said it, because I was all worried about it.","Stapley：我很高興我說了，因為我一直很擔心。"
"00:27:33,340 --> 00:27:34,308","So I think so.","所以我想是這樣。"
"00:27:34,308 --> 00:27:36,868","I think we're going to try to start doing that.","我想我們會開始試著這麼做。"
"00:27:37,460 --> 00:27:39,924","Schafer: Like I'll feel a lot better once we made one of something.","Schafer：只要我們先做出一個像樣的東西，我就會安心很多。"
"00:27:39,924 --> 00:27:46,552","Like once, 'cause I was feeling like we had not yet accomplished, the game was looking good and coming along, right.","因為我一直覺得我們還沒做到，遊戲看起來不錯，也有在往前，對吧。"
"00:27:46,560 --> 00:27:53,911","But we'd not yet accomplished that thing of seeing something in the playable version of the game that had that crazy Bagel-style yet.","但我們還沒做到那件事，也就是在可玩版本裡看到帶有那種瘋狂 Bagel 風格的東西。"
"00:27:54,180 --> 00:27:59,840","Like the special element of like surrealism or just kind of dream logic that his paintings might have.","像是他的畫裡可能有的那種超現實元素，或某種夢境邏輯。"
"00:27:59,840 --> 00:28:00,940","I hadn't yet seen in the game yet.","我還沒在遊戲裡看到那個。"
"00:28:00,940 --> 00:28:03,581","So once we have something like that in the game, I'll be like, OK, great.","所以一旦遊戲裡有那樣的東西，我就會覺得：「OK，很好。」"
"00:28:03,920 --> 00:28:07,900","We just need to do that a whole bunch of times then I'll feel a lot more relaxed.","接著我們只要把那件事重複很多次，我就會放鬆很多。"
"00:28:08,520 --> 00:28:13,180","But until you achieve that, there's always this question of like will you be able to achieve what you want to do.","但在你做到之前，心裡總會有個疑問：你到底能不能達成你想做的事。"
"00:28:13,900 --> 00:28:19,039","You know, it's tricky, 'cause you got to make, get the game to look the way you want it to look,","你知道，這很棘手，因為你得讓遊戲看起來像你想要的樣子，"
"00:28:19,040 --> 00:28:23,480","but also get done on time with the people that you have and also all those people have to be happy.","也要用現有的人手準時完成，而且所有人還都得開心。"
"00:28:23,960 --> 00:28:27,478","Yeah, like you're trying to get people to contribute their whole selfs to the project.","對，就像你想讓大家把完整的自己投入這個專案。"
"00:28:27,900 --> 00:28:30,020","So that's challenging.","所以那很有挑戰性。"
"00:28:30,020 --> 00:28:36,306","But it's what I spent the most of my time recently, like the last ten years recently, like doing, like trying to solve that problem.","但那也是我最近大部分時間，或者說最近十年，大多都在做的事，試著解決這個問題。"
"00:28:36,540 --> 00:28:44,771","How to make a group of people work well together and bring the best ideas forth and make good stuff together.","怎麼讓一群人好好合作，把最好的點子帶出來，一起做出好東西。"
"00:28:44,969 --> 00:29:28,189","[Music]","[音樂]"
