"Timecode","Content","Content_zh"
"00:12:05,427 --> 00:12:11,480","Because as soon as one person goes live with it, every single other person who publishes it is not violating shit.","因為只要有一個人先發出去，後面每個報導的人就都不算違反什麼鬼了。"
"00:12:11,480 --> 00:12:14,540","In fact, they're almost derelict in their duties for just ignoring it.","他們因為不理會而幾乎失職了"
"00:12:14,540 --> 00:12:18,475","Because as far as they're, from their perspective, it's public information that's already out there.","因為從他們的觀點來看 已經是公共資訊了"
"00:12:18,480 --> 00:12:27,462","So you're being actually just kind of a weird like lackey to some developer if you're just saying, well, they wanted me to not do it.","如果你只是說，好吧，他們希望我不要報，那你反而像是某個開發商奇怪的走狗。"
"00:12:27,462 --> 00:12:28,522","Rice: That was the case.","Rice：就是這樣"
"00:12:28,522 --> 00:12:30,834","Like once one person broke it, then now it's public.","只要有一個人爆出來，現在它就是公開資訊了。"
"00:12:32,160 --> 00:12:36,252","Schafer: Then looking back on it, we could have done a lot of things different, but I don't want to learn the lesson.","Schafer：回頭看，我們本來可以有很多不同做法，但我不想學到那個教訓。"
"00:12:36,260 --> 00:12:39,160","The most obvious lesson that you could learn from that, is that you should be less transparent.","你從中可以學到的最明顯的教訓是 你應該少點透明度"
"00:12:39,160 --> 00:12:44,020","Like OK, we were just so open and transparent and all that, that we could have probably like,","像是，好，我們太開放、太透明了，所以我們也許本來可以，"
"00:12:44,180 --> 00:12:49,200","we could have probably massaged that message better and hid a lot of stuff, but I don't know if that's really the lesson","把訊息包裝得更好，藏起很多東西，但我不知道這是不是我真的想學到的教訓。"
"00:12:49,200 --> 00:12:50,980","I want to learn from that, you know what I mean?","我想從中學習，你知道我的意思嗎？"
"00:12:50,980 --> 00:12:56,469","Like if we had hid the whole thing and just been like, you know, every three months push the launch date out three months","如果我們把整件事藏起來，只是像大多數遊戲公司那樣，"
"00:12:56,469 --> 00:12:59,393","like most companies do with games, so they just slip it out.","每三個月把發行日往後推三個月，慢慢滑出去。"
"00:12:59,700 --> 00:13:00,680","And then, then hey!","然後，然後，然後嘿！"
"00:13:00,680 --> 00:13:04,015","By the way, I know it's not coming out 'til May, but here's an early access thing in January.","順帶一提，我知道它要到五月才出，但一月有 Early Access。"
"00:13:04,020 --> 00:13:06,600","That's a great thing, everyone would have been wow, that's great.","那就會變成很棒。的事，大家都會覺得，哇，太好了。"
"00:13:08,500 --> 00:13:12,748","So being more secretive could have protected us from that, from that bad public response.","所以更保密也許能保護我們，免於遭遇那種負面的公開反應。"
"00:13:12,748 --> 00:13:17,818","But that goes against everything that we're trying to do with the project, was to be completely open and show everybody everything.","但那違背了我們做這個專案的一切初衷：完全公開，讓大家看到所有事情。"
"00:13:17,820 --> 00:13:20,491","Remo: Part of it's also this was just like a learning experience for us in a way.","Remo：部分原因也是 這就像我們學習的經驗"
"00:13:20,491 --> 00:13:25,311","I think that even if we do have another thing that is this significant that we're putting out there,","我想即使我們有另外一件重要的事情 被我們放出來"
"00:13:25,320 --> 00:13:30,940","I think we would just, knowing this was going to happen, probably could have done it a little smarter.","我覺得我們如果知道會發生這種事，也許可以做得聰明一點。"
"00:13:31,120 --> 00:13:34,625","At the time, I don't know how we would have necessarily had that foresight.","當時我不知道我們怎麼會有這種預感"
"00:13:34,780 --> 00:13:39,540","Like to the degree it would have been necessary, but I think we just need to be more careful.","盡管如此 但我們需要小心一點"
"00:13:40,560 --> 00:13:45,770","Schafer: And now it's out there and whatever, you know, the press makes of it or whatever weird comments we get from people","Schafer：現在它就在外面 不管媒體怎麼說 或是我們從別人那裡得到的奇怪評論"
"00:13:45,770 --> 00:13:48,648","who weren't backers, that's over.","不是贊助者的人那些話，就到此為止了。"
"00:13:48,900 --> 00:13:58,100","Well, it might go on tonight and tomorrow, but we production-wise have moved past that and are just now focusing on the game.","好吧，今晚和明天可能還會繼續，但製作上我們已經跨過去了，現在就是專注做遊戲。"
"00:14:05,460 --> 00:14:05,960","Schafer: Hello.","Schafer：你好"
"00:14:08,266 --> 00:14:09,317","Schafer: Oh man, look at that.","Schafer：喔，天啊，看看那。"
"00:14:09,317 --> 00:14:11,782","It's like the whole town.","就像整座城市"
"00:14:11,782 --> 00:14:15,466","The whole town looks like it's got sugar, like little sugar canisters; that's awesome.","整個鎮看起來像灑滿糖，像一個個小糖罐，太棒了。"
"00:14:15,466 --> 00:14:22,977","Gardner: Right now we're kind of like in the middle of switching from, I mean I'm sure you've heard from the spaceship to the Vella's","Gardner：現在我們差不多正在從太空船切換到 Vella 那邊，"
"00:14:22,977 --> 00:14:25,928","like neighborhood and baker town and all that stuff.","像是她的鄰里、麵包小鎮那些東西。"
"00:14:25,928 --> 00:14:28,277","Roberts: Yeah, this is the first shot that they'll see.","Roberts：對，這是他們會看到的第一個鏡頭。"
"00:14:28,277 --> 00:14:36,756","And so what we're doing is layouts right now, where we're just basically getting the staging with the art backgrounds","所以我們現在做的是 layout，基本上就是把美術背景和角色的調度先擺進去，"
"00:14:36,756 --> 00:14:40,170","and the characters in and we're doing what we call rough blocking.","也就是我們稱為 rough blocking 的東西。"
"00:14:40,170 --> 00:14:45,706","So in the play-throughs we can all watch it with Tim and everybody and just say, OK, does that work?","這樣在完整遊玩時，我們就能和 Tim 還有大家一起看，然後說，好，這樣行嗎？"
"00:14:45,706 --> 00:14:50,445","Does this work with the game?","這對遊戲有用嗎？"
"00:14:50,445 --> 00:14:52,743","Schafer: It's pretty important, I guess, that we figure out where everyone's standing.","Schafer：我想我們必須找出大家的立場"
"00:14:52,743 --> 00:14:55,844","Because this is like the, like the final resting place for everyone, do you think?","因為這像是大家最後會停留的位置，你覺得呢？"
"00:14:55,844 --> 00:14:57,110","Where we want them?","我們要他們去哪兒？"
"00:14:57,110 --> 00:14:58,319","Petty: The witch is facing the wrong way.","Petty：女巫面向錯了。"
"00:14:58,319 --> 00:15:04,486","She should be facing towards the cake, but we needed enough space for you to be able to walk around without accidentally clicking on someone.","她應該正對著蛋糕 但我們需要足夠的空間 讓你可以不意外地點擊某人"
"00:15:04,486 --> 00:15:06,434","And that was, that was where we wound up.","結果位置就變成那樣。"
"00:15:06,434 --> 00:15:10,104","Schafer: He could also be shoved facing left over here more.","Schafer：他也可能被推到左邊"
"00:15:10,104 --> 00:15:12,604","'Cause this thing is, this is a kind of unnecessary thing...","因為這事情是，這是一種不必要的事情……"
"00:15:12,604 --> 00:15:13,575","Petty: We can just paint that out.","Petty：我們可以直接把那塊修掉。"
"00:15:13,575 --> 00:15:21,937","Schafer: And it looks so prominent, that you kind of want to play with it, but you could use that shelf space, too, if he was like closer to it or something?","Schafer：它看起來很突出，所以你想玩它，但你也可以使用那個架子的空間，如果他像更接近它什麼的？"
"00:15:21,937 --> 00:15:26,440","So you wouldn't be tempted to walk, like you'd be tempted to walk this way around him instead of this way.","所以你不會想走 就像你想走在他身邊而不是這樣"
"00:15:26,440 --> 00:15:30,668","Petty: We could always put like little photos of, maybe there's like little black and white photos of him","Petty：我們總是可以把像小照片，也許有像小黑白照片的他"
"00:15:30,668 --> 00:15:32,002","as a young warrior or something.","是個年輕的戰士"
"00:15:32,002 --> 00:15:35,031","Like he's staring at like his past, you know, or whatever.","就像他像往事一樣盯著看"
"00:15:35,031 --> 00:15:37,138","If you want to put some little subtle stuff there.","如果你想放點微妙的東西"
"00:15:37,138 --> 00:15:38,913","Schafer: OK.","Schafer：好"
"00:15:38,913 --> 00:15:43,827","Offscreen Voice: Well, you know, we try to put as much in as we can, because we're so limited on time.","畫外音：嗯，你知道，我們盡量能放多少就放多少，因為時間非常有限。"
"00:15:43,827 --> 00:15:50,889","So we know a lot of this stuff is going to change once we get final dialogue, because we don't have the final actors.","所以我們知道，等拿到最終對白後，很多東西都會改，因為我們還沒有正式演員。"
"00:15:50,889 --> 00:15:54,115","We don't have those recordings and that can change a lot of the timing.","我們沒有那些錄音，而那會大幅改變很多時間點。"
"00:15:54,115 --> 00:15:56,822","Garner: Famous people, like real actors?","Garner：名人，像真正的演員？"
"00:15:56,822 --> 00:16:01,494","They all read dialogue a lot slower than our scratch dialogue.","他們念對白都比我們的暫錄對白慢很多。"
"00:16:01,494 --> 00:16:09,776","Our scratch dialogue is when we go in and do recordings and we all sort of act out the characters.","暫錄對白就是我們自己進去錄音，大家大致把角色演出來。"
"00:16:09,776 --> 00:16:19,267","Garner: Bring me a star chart and the fabric of time and space shall be knit to serve your passage.","Garner：把星圖拿來，時空的織物將被編織起來，服務你的旅程。"
"00:16:19,267 --> 00:16:24,120","[Inaudible 00:16:19] Stamos: I came in this morning and Cam's like,","[聽不清 00:16:19] Stamos：我今天早上進來，Cam 就說，"
"00:16:24,120 --> 00:16:26,739","he said we need some more mom voice.","他說我們需要更多媽媽的聲音"
"00:16:26,739 --> 00:16:28,108","So I'm like, oh, all right.","所以我喜歡，哦，好吧。"
"00:16:28,108 --> 00:16:29,781","I guess that's me.","我猜是我"
"00:16:29,781 --> 00:16:34,034","Stoddard: I actually like, I really like, I like how you did the mom.","Stoddard：我其實很喜歡，我真的很喜歡你演媽媽的方式。"
"00:16:34,034 --> 00:16:39,714","Stamos: Well, I'm reading it just as me, so since I am a mom, I guess that's OK.","Stamos：嗯，我就是照自己的樣子念，既然我是媽媽，我想這樣也可以。"
"00:16:39,714 --> 00:16:41,530","Stoddard: You got a good mom voice.","Stoddard：你媽媽的聲音很好聽"
"00:16:41,530 --> 00:16:44,532","Rice: Is there anybody else on this ship?","Rice：這艘船上還有人嗎？"
"00:16:44,532 --> 00:16:49,926","So you've never seen a strange wolf around?","你從沒見過奇怪的狼嗎？"
"00:16:49,926 --> 00:16:52,438","Stoddard: Well done. Rice: All right.","Stoddard：幹得好 好的"
"00:16:52,438 --> 00:17:00,396","Team Member: So we would like to try to get as much as could into these scenes without having to change everything entirely.","團隊成員：所以我們希望盡量把能放的東西放進這些場景，不要等到拿到最終對白後全部重改。"
"00:17:00,396 --> 00:17:01,925","Once we get that final dialogue.","一旦我們得到最後對話"
"00:17:01,925 --> 00:17:07,781","So we're kind of doing a lot of stuff that you would do sequentially, all at once.","所以我們有點是在把很多本來會依序做的事情一次做完。"
"00:17:07,781 --> 00:17:11,604","Schafer: And they try not to do too much, so you can tell some of them are animating more than they should there,","Schafer：他們也試著不要做太多，所以你看得出有些地方動畫做得比應該做的還多，"
"00:17:11,604 --> 00:17:13,638","because they just wanted to make a nice scene.","因為他們只是想拍個好戲"
"00:17:13,638 --> 00:17:19,510","And soon we're going to file dialogue for all that, so we'll be able to polish that up like we couldn't before.","很快我們就會有這些最終對白，所以就能把它們打磨到以前做不到的程度。"
"00:17:19,510 --> 00:17:21,551","Schafer: Should we just start listening to stuff.","Schafer：我們該開始聽東西了"
"00:17:21,551 --> 00:17:23,731","Brown: Yeah, we can just go down the list.","Brown：是的，我們可以從名單上下來"
"00:17:23,732 --> 00:17:25,619","Schafer: Let's do it.","Schafer：走吧"
"00:17:25,619 --> 00:17:29,108","Khris and I started working together at Lucas Arts in the '90s.","Khris 和我是在 90 年代於 LucasArts 開始共事的。"
"00:17:29,108 --> 00:17:31,257","Like she started, Brown: 1990.","就像她開始的，Brown：1990年。"
"00:17:31,257 --> 00:17:34,506","Schafer: What was your first job title at Lucas Arts?","Schafer：你在 LucasArts 的第一個職稱是什麼？"
"00:17:34,506 --> 00:17:37,166","Brown: I was the Product Support Supervisor.","Brown：我是產品支援主管"
"00:17:37,166 --> 00:17:39,117","Schafer: Yeah, she was in Prod Sup, yeah.","Schafer：是的，她在普洛德蘇普，是的。"
"00:17:39,117 --> 00:17:44,486","And then, but the first thing you did sound on for me is Full Throttle, right?","然後，你第一次幫我的作品做聲音，是《Full Throttle》對吧？"
"00:17:44,486 --> 00:17:47,091","Brown: Uh, Schafer: Or did Tentacle, no you were in...","Brown：呃，Schafer：還是《Tentacle》？不，你在……"
"00:17:47,091 --> 00:17:48,094","Brown: Day of the Tentacle.","Brown：《Day of the Tentacle》。"
"00:17:48,094 --> 00:17:49,276","Schafer: You were in Day of the Tentacle.","Schafer：你參與過《Day of the Tentacle》。"
"00:17:49,276 --> 00:17:53,380","Brown: We said dirty things to Mark Hamell in his headphones and that's true.","Brown：我們對著 Mark Hamill 的耳機講髒話，這是真的。"
"00:17:53,380 --> 00:17:54,703","Schafer: We learned a lot.","Schafer：我們學了很多"
"00:17:54,703 --> 00:17:56,106","Brown: And we learned a lot.","Brown：我們學了很多"
"00:17:56,106 --> 00:17:57,347","Schafer: You've learned a lot since then.","Schafer：從那以後你學了很多"
"00:17:57,347 --> 00:18:00,355","Super-professional mature now.","現在超專業、超成熟。"
"00:18:00,355 --> 00:18:02,316","Let's listen to some more voices.","讓我們聽聽更多的聲音。"
"00:18:02,316 --> 00:18:05,321","Schafer: I had a meeting with Khris where I actually listened to the first auditions.","Schafer：我和 Khris 開了會 在那裡我聽了第一次試鏡"
"00:18:05,321 --> 00:18:07,546","So we listened to a whole bunch of auditions.","所以我們聽了一堆試鏡"
"00:18:07,546 --> 00:18:09,223","A few of them were good, but it's just the start.","有一些是好的，但這只是開始。"
"00:18:09,223 --> 00:18:11,320","We're going to listen to a whole lot more auditions.","我們要聽更多的試鏡"
"00:18:11,320 --> 00:18:13,495","We have a bunch of characters to cast.","我們有很多角色要演"
"00:18:13,495 --> 00:18:18,034","Audition Voice: You came because you are done with children's games.","Audition Voice：你會來，是因為你已經受夠小孩子的遊戲了。"
"00:18:18,034 --> 00:18:23,653","My name is Merrick and what I'm about to show you is no game.","我叫 Marek，我接下來要給你看的東西可不是遊戲。"
"00:18:23,653 --> 00:18:25,404","Schafer: Pretty good, but I think I like the other guy.","Schafer：很好，但我比較喜歡另一個人。"
"00:18:25,404 --> 00:18:28,276","Audition Voice: David Kaufman Merrick. Schafer: Whoa.","Audition Voice：David Kaufman， Marek。Schafer：哇。"
"00:18:28,276 --> 00:18:31,681","Audition Voice: You came because you are done with children's games.","Audition Voice：你會來，是因為你已經受夠小孩子的遊戲了。"
"00:18:31,681 --> 00:18:36,242","My name is Merrick and what I'm about to show you is no game.","我叫 Marek，我接下來要給你看的東西可不是遊戲。"
"00:18:36,242 --> 00:18:45,571","While you've been drifting through the universe, eating ice cream and playing with trains, war has been raging across the galaxy.","當你漂流在宇宙中 吃著冰淇淋 玩著火車時 戰爭一直在星系中肆虐"
"00:18:45,571 --> 00:18:53,860","Between the forces that every war is between, between the powerful and the weak, the tyrants and the innocent.","在每場戰爭的勢力之間 權力和弱勢之間 暴君和無辜者之間"
"00:18:53,860 --> 00:18:57,111","Does it even matter there will always be war.","這重要嗎？戰爭永遠都會存在。"
"00:18:57,111 --> 00:19:01,305","We did not start it and we cannot stop it.","不是我們挑起的，我們也無法阻止。"
"00:19:01,305 --> 00:19:10,968","But what we can do is protect the weak and rescue the helpless.","但是我們能做的是保護弱者 拯救無助者"
"00:19:10,968 --> 00:19:12,529","Schafer: That guy's pretty awesome.","Schafer：那傢伙真棒。"
"00:19:12,529 --> 00:19:14,419","Is it a higher pitch than I imagined him having?","比我想像的要高？"
"00:19:14,419 --> 00:19:16,310","But I love how he read it.","但我喜歡他的念法。"
"00:19:16,310 --> 00:19:18,239","Schafer: Well, we had our first casting session.","Schafer：嗯，我們剛進行了第一次選角會議。"
"00:19:18,239 --> 00:19:22,653","Khris was on Skype and I was listening to all the auditions.","Khris 在 Skype 上，我在聽所有試鏡。"
"00:19:22,653 --> 00:19:23,408","They were good.","很棒。"
"00:19:23,408 --> 00:19:28,198","There were a couple characters that I felt like, that's exactly right; we could use that voice.","有幾個角色我覺得，對，就是這樣；我們可以用那個聲音。"
"00:19:28,198 --> 00:19:33,457","For a lot of them, and the main ones, I think it's going to be a longer process where we just take the first listen","對很多角色，尤其主要角色，我覺得會是更長的過程，我們只是先聽第一輪。"
"00:19:33,457 --> 00:19:36,685","and then Khris and I have something that we can talk to together.","然後 Khris 和我就有東西可以一起討論。"
"00:19:36,685 --> 00:19:41,000","Like where is this, instead of just reaching out in the dark, we're like, OK, now we've heard a voice.","而不是在黑暗中摸索；我們現在會說，好，我們已經聽到一個聲音了。"
"00:19:41,000 --> 00:19:42,569","Is it older, younger than this?","這聲音要再老一點，還是再年輕一點？"
"00:19:42,569 --> 00:19:45,161","Is it meaner or nicer than this?","比這更兇，還是更親切？"
"00:19:45,161 --> 00:19:54,472","You know, we can talk about all the different ways we want to use that as a landmark to know, navigate to actual voice that we want.","我們可以把它當成地標，討論各種方向，慢慢導航到我們真正想要的聲音。"
"00:19:54,472 --> 00:19:59,032","Is that a good metaphor?","這是個好比喻嗎？"
"00:19:59,032 --> 00:20:01,819","Schafer: OK. Well, we have a company meeting at 2:00 o'clock also.","Schafer：好 我們兩點還有公司會議"
"00:20:01,819 --> 00:20:03,160","Brown: Oh.","Brown：喔。"
"00:20:03,160 --> 00:20:06,254","Schafer: Oh God. What do you think is the most important thing to listen to?","Schafer：天啊 你認為最重要的事情是什麼？"
"00:20:06,254 --> 00:20:10,331","Brown: I think the most important things to listen to are Shay and Vella.","Brown：我想最重要的是 Shay 和 Vella"
"00:20:10,331 --> 00:20:11,237","Schafer: Vella.","Schafer：Vella。"
"00:20:11,237 --> 00:20:13,438","Let's listen to some Vellas.","來聽幾個 Vella 吧。"
"00:20:13,438 --> 00:20:19,745","Audition Voice: Need help cleaning up?","Audition Voice：需要幫忙打掃嗎？"
"00:20:19,745 --> 00:20:20,586","Schafer: There's something wrong with that one.","Schafer：那個有點不對勁。"
"00:20:20,586 --> 00:20:22,503","I don't know what it is.","我不知道是哪裡。"
"00:20:22,503 --> 00:20:29,367","Audition Voice: Hi. Need help cleaning up?","Audition Voice：嗨 需要幫忙打掃嗎？"
"00:20:29,367 --> 00:20:31,820","Schafer: Not bad.","Schafer：不錯"
"00:20:31,820 --> 00:20:37,010","Audition Voice: I think it's time we start fighting that monster.","Audition Voice：我想我們該和那個怪物戰鬥了"
"00:20:37,010 --> 00:20:39,939","Schafer: It sounds really young to me, it's like her little sister, but I don't know.","Schafer：對我來說聽起來真的很年輕，像她妹妹，但我也不確定。"
"00:20:39,939 --> 00:20:42,767","I'm trying to think of what 14 year old girls sound like.","我在想 14 歲女孩聽起來是什麼樣子。"
"00:20:42,767 --> 00:20:54,325","Khris: There's a sample of a 15 year old girl and her audition is bitchy and I don't like it,","Khris：有一個 15 歲女孩的樣本，她的試鏡很跩，我不喜歡，"
"00:20:54,325 --> 00:21:00,175","but it just gives you an idea of what a 15 year old girl sounds like.","但它至少能讓你知道 15 歲女孩聽起來是什麼樣子。"
"00:21:00,175 --> 00:21:02,007","Audition Voice: What you got?","Audition Voice：你有什麼？"
"00:21:02,007 --> 00:21:03,911","Let me see that.","讓我看看"
"00:21:03,911 --> 00:21:06,579","Nah, I don't really need it that bad.","不，我真的不需要它。"
"00:21:06,579 --> 00:21:10,598","Schafer: Her acting is kind of a problem.","Schafer：她的演技有點問題"
"00:21:10,598 --> 00:21:14,465","Hm. OK. All right.","嗯，好，好吧"
"00:21:14,465 --> 00:21:17,070","Brown: Oh no! I hate to make you sad.","Brown：喔，不！我不想讓你傷心"
"00:21:17,070 --> 00:21:21,805","Do you want to hear all the ""B"" list ones that didn't get put up?","你想聽那些沒有上傳的 B 級名單嗎？"
"00:21:21,805 --> 00:21:25,513","Schafer: Oh no, I was just saying, you know, I mean listen to them all.","Schafer：喔，不，我只是說，你知道，我的意思是聽他們全部。"
"00:21:25,513 --> 00:21:27,127","Brown: We have tons of auditions.","Brown：我們有很多次試鏡"
"00:21:27,127 --> 00:21:28,899","Schafer: I know. I mean, is there anything really unique in there?","Schafer：我知道 裡面有什麼特別的嗎？"
"00:21:28,899 --> 00:21:33,086","I guess I was looking for something that was kind of special, unique in some way.","我想我在找一些特殊，獨特的東西"
"00:21:33,086 --> 00:21:34,509","Brown: Special like?","Brown：特別嗎？"
"00:21:34,509 --> 00:21:36,689","Schafer: Super likable. They're all good.","Schafer：超棒的 他們都很好"
"00:21:36,689 --> 00:21:37,969","I mean, they're all good.","我的意思是，他們都很好。"
"00:21:37,969 --> 00:21:44,726","They're all in the right, correct range, I think, in age for the most part, except for that one that sounded really young.","他們都在正確的範圍，我想，在大部份的年齡，除了那個聽起來很年輕。"
"00:21:44,726 --> 00:21:50,896","I guess I was looking for one with like a personality that would leap out at me.","我想我在找一個像個性會跳出來的人"
"00:21:50,896 --> 00:21:52,096","But I think it just takes time.","但我覺得這需要時間"
"00:21:52,096 --> 00:21:55,231","I think I just have to listen to them a whole bunch of times.","我想我只是得多聽幾次。"
"00:21:55,231 --> 00:22:00,227","Brown: Yeah, but I don't want you to be like beat into submission, beaten into submission,","Brown：對，但我不希望你像是被逼到屈服，"
"00:22:00,227 --> 00:22:03,765","like and reconcile yourself to something less than what you truly want, you know?","然後勉強接受不是真正想要的東西，你懂嗎？"
"00:22:03,765 --> 00:22:04,773","Schafer: When would I ever do that?","Schafer：我什麼時候會這麼做？"
"00:22:04,773 --> 00:22:06,408","When would I ever let that happen?","我什麼時候能讓這種事發生？"
"00:22:06,408 --> 00:22:07,509","Anyway, that's how it goes.","總之，事情就是這樣的"
"00:22:07,509 --> 00:22:14,713","Schafer: You get the first listen and now Khris and I, whoa, [inaudible 00:22:08], I spit all over my Rubik's cubes.","Schafer：第一次聽完之後，現在 Khris 和我，哇，[聽不清 00:22:08]，我口水噴滿了我的魔術方塊。"
"00:22:14,713 --> 00:22:19,737","Yeah, no, she has a little clearer idea of what I think of each character now that we have something to compare it to.","對，不，她對我對每個角色的看法有更清楚的瞭解 因為我們有東西可以比對"
"00:22:19,737 --> 00:22:25,040","And I'm still, still pursuing some like, friends, friends and famous people for the game.","而且我還在替這款遊戲找一些朋友、朋友和名人。"
"00:22:25,040 --> 00:22:26,324","We'll see where that goes.","看看會怎樣"
