"Timecode","Content","Content_zh"
"00:22:26,324 --> 00:22:29,922","I don't want to say anything , 'cause what if it doesn't happen, I'll just feel stupid.","我不想說，因為萬一沒成，我會覺得自己很蠢。"
"00:22:29,922 --> 00:22:34,325","Schafer: Possible, one might say celebrity cameos in the game?","Schafer：可以說遊戲裡可能會有名人客串嗎？"
"00:22:34,325 --> 00:22:36,498","Me, just me.","我啦，只有我。"
"00:22:36,498 --> 00:22:39,393","Actual bona fide celebrities.","真正貨真價實的名人。"
"00:22:39,393 --> 00:22:41,755","Offscreen Voice: People that we've used, actors that we've used before?","畫外音：我們以前合作過的人、以前用過的演員嗎？"
"00:22:41,755 --> 00:22:44,777","Schafer: My hope is to use actually a lot of people that we have used before, just for some fun small parts,","Schafer：我希望其實能用很多以前合作過的人，演一些有趣的小角色，"
"00:22:44,777 --> 00:22:51,240","like Richard Horovitz and Nicky Rapp and contact Mr. Black, see if he's available.","比如理查德·霍羅維茨和尼克·拉普 聯繫布萊克先生 看看他是否有空"
"00:22:51,240 --> 00:22:52,967","He offered to do that, like before.","他以前提過願意做。"
"00:22:52,967 --> 00:22:54,054","Offscreen Voice: Oh, he did?","畫外音：喔，他有嗎？"
"00:22:54,054 --> 00:23:03,090","Schafer: He said, Offscreen Voice: He should be the hipster lumberjack.","Schafer：他說…… 畫外音：他應該演潮流伐木工。"
"00:23:03,090 --> 00:23:06,900","Petty: You know, last week I got some of the UI stuff cut up and integrated.","Petty：你知道，上週我把一些 UI 東西切好並整合進去了。"
"00:23:06,900 --> 00:23:13,478","And I also got most of the way through doing the kind of like, they're not implemented in the game yet, but the white box for all the Shellmound.","我也大致完成了所有 Shellmound 的 white box；它們還沒實作進遊戲裡。"
"00:23:13,478 --> 00:23:17,414","My goal is to get those all in the game and hooked up by end of the week.","我的目標是在這週結束前，把它們全放進遊戲並接好。"
"00:23:17,414 --> 00:23:21,501","Petty: This is really kind of where a white box, now we do have some basic layering set up here.","Petty：這裡基本上就是 white box，不過我們現在已經有一些基本分層。"
"00:23:21,501 --> 00:23:23,519","And I did some basic camera work.","我也做了一些基本的鏡頭處理。"
"00:23:23,519 --> 00:23:26,944","But this shows the basic layout of the scene, the key elements in place.","但這顯示了場景的基本 layout，關鍵元素到位。"
"00:23:26,944 --> 00:23:35,382","So these are, you know, just quick black and white drawings, but they, some of them like this, without going into too much detail,","所以這些是，你知道的，只是快速的黑白畫，但他們，有些像這樣，沒有太多的細節，"
"00:23:35,382 --> 00:23:40,648","this particular scene has a very strange layout in some ways because you have to see this sort of distant view of Shellmound,","這個特定場景的 layout 在某些方面很奇怪，因為你必須看到 Shellmound 的遠景，"
"00:23:40,648 --> 00:23:42,755","because it sets up something that happens later.","因為它安排了一些後來發生的事"
"00:23:42,755 --> 00:23:46,410","So it really wasn't that any of these are the final shapes or languages or anything.","所以這些都不是最終的形狀、視覺語言或任何定稿。"
"00:23:46,410 --> 00:23:53,682","Or even really the final shot, as much to make sure that all those elements had a place and could work together in a single screen composition.","甚至也不算最終鏡頭，重點是確保所有元素都有位置，能在單一畫面構圖中一起運作。"
"00:23:53,682 --> 00:23:59,447","So you kind of have to work at a certain level of detail just to be able to figure that out and to communicate that to Bagel.","所以你得做到某種細節程度，才能弄清楚並把它傳達給 Bagel。"
"00:23:59,447 --> 00:24:03,382","Petty: My goal is to get all those all in the game and hooked by end of the week.","Petty：我的目標是在這週結束前，把這些全放進遊戲並接好。"
"00:24:03,382 --> 00:24:05,096","Schafer: It will close, too.","Schafer：也快接近了。"
"00:24:05,096 --> 00:24:07,365","Being almost all white boxed.","幾乎全都 white box 完了。"
"00:24:07,365 --> 00:24:09,305","Camden, world of sound.","Camden，音效世界。"
"00:24:09,305 --> 00:24:17,020","Stoddard: Last week it was mostly filling out space ship and there's still a few glitches timing stuff that I have to work on and kind of tighten up.","Stoddard：上週主要是在補太空船，還有一些 timing 上的小問題得處理、收緊。"
"00:24:22,940 --> 00:24:23,480","Stoddard: Yeah.","Stoddard：對。"
"00:24:24,200 --> 00:24:30,500","It's a super high tech spaceship, but at the same time, like I kind of think it would be kind of fun to like have stuff kind of squeaky","這是超高科技太空船，但同時我覺得讓一些東西有點吱嘎作響會很有趣。"
"00:24:30,500 --> 00:24:34,180","and you can hear the wheels and the joints working and things like that.","你可以聽到輪子和關節的聲音 以及那樣的聲音"
"00:24:34,180 --> 00:24:38,862","So I'm trying to get some elements with Laura's key card.","所以我想用 Laura 的門禁卡收一些元素。"
"00:24:39,480 --> 00:24:40,680","Laura: Ready? Stoddard: Yep.","Laura：好了嗎？是的"
"00:24:47,840 --> 00:24:51,360","Great. Awesome. Laura: Yeah, yeah? Stoddard: Perfect.","太好了。很棒。。Laura：可以嗎？Stoddard：完美。"
"00:24:51,360 --> 00:24:57,000","And I'm starting to do some things with like phase and modulation.","我也開始做一些像 phase 和 modulation 的東西。"
"00:24:57,520 --> 00:24:58,520","[Squeaky sounds].","[吱嘎聲]。"
"00:25:01,980 --> 00:25:04,640","Getting like this almost like alien machinery sound.","就像是外星機器一樣"
"00:25:06,180 --> 00:25:12,900","But I was also noticing some of its properties I could do for like some of the robots.","但我也注意到它的一些屬性 我可以做一些機器人。"
"00:25:14,840 --> 00:25:16,060","Like almost chattering.","就像在聊天"
"00:25:17,120 --> 00:25:18,600","Schafer: Cool. Rusty?","Schafer：酷。Rusty？"
"00:25:20,080 --> 00:25:24,060","Russell: Beginning of the week was mostly some prop stuff for the girl's house.","Russell：這周開始 主要是給女孩家的道具"
"00:25:24,060 --> 00:25:28,201","And then it's up to the Mog Chothra one so you get the textures done.","接下來輪到 Mog Chothra，所以你要把材質做完。"
"00:25:28,201 --> 00:25:36,683","Russell: So Adrien was actually involved with doing the character modeling and the rigging, but he went off to another project to help out.","Russell：Adrien 其實有參與角色建模和 rigging，但他去另一個專案幫忙了。"
"00:25:41,320 --> 00:25:43,980","Offscreen Voice: This was supposed to be a shot of you, hard at work on another project.","畫外音：這本來應該是拍你在另一個專案努力工作的畫面。"
"00:25:44,320 --> 00:25:49,120","[Laughter] Skillman: The backers are going to love that.","[笑聲] Skillman：贊助者一定會喜歡。"
"00:25:50,639 --> 00:25:55,743","Russell: But because they had a vacancy to fill because Adrien left, I'm the next guy up.","Russell：但因為 Adrien 離開後有空缺要補，我就是下一個頂上的人。"
"00:25:55,743 --> 00:25:56,363","So yeah.","所以是的。"
"00:25:57,706 --> 00:26:01,406","Some of the stuff I'm doing is just like going back through old files.","我做的一些事情就像翻過舊檔案一樣"
"00:26:01,406 --> 00:26:04,826","Like a lot of this stuff was made for the actual teaser trailer.","很多東西其實是為原本的 teaser trailer 做的。"
"00:26:04,826 --> 00:26:13,526","And Adrien's got a lot of rigging things that he did for us that in the meantime that some of these older rigs need to get updated with.","Adrien 之前幫我們做了很多 rigging，現在有些舊 rig 得拿那些東西來更新。"
"00:26:13,526 --> 00:26:19,546","So like this girl, this is the girl in the cake that you probably saw in the trailer.","像這個女孩，這就是你可能在預告片裡看到、在蛋糕裡的女孩。"
"00:26:19,720 --> 00:26:26,400","I'm adding actually the lower half of her body so that when she gets pulled out, you know, she actually has a body that comes with it.","我加入她的下半身 所以當她被拉出來時 她的身體會隨之而來"
"00:26:26,940 --> 00:26:32,540","So he was also done pretty early on in the project, so we kind of revamped him and revamped his skeleton.","所以他也是專案很早期就做好的，我們就重新改造他，也改了他的骨架。"
"00:26:32,540 --> 00:26:42,719","So he's got some, some other controls now that you can kind of do a little parallax so that if he's trying to turn, this part can,","所以他現在有一些其他控制，可以做一點 parallax；如果他要轉身，這一塊就可以，"
"00:26:42,720 --> 00:26:46,080","you know, look like it's going behind him a little bit.","看起來好像有點落後了"
"00:26:46,080 --> 00:26:50,169","He's got the ability to open his jaw and stuff now.","他現在有能力打開他的下巴和東西"
"00:26:50,169 --> 00:26:59,369","Schafer: Jessie! Whoa! That's scary.","Schafer：傑西！哇！真可怕"
"00:27:00,340 --> 00:27:03,563","Schafer: I've actually been able to write now so I wrote the Maidens Feast stuff as you saw","Schafer：我其實終於能寫東西了，所以我寫了你們看到的 Maidens Feast 內容。"
"00:27:03,563 --> 00:27:07,043","and that's been delivered and Malena's putting that in the database right now.","那已經交付了，Malena 現在正在把它放進資料庫。"
"00:27:07,043 --> 00:27:09,863","And then the next thing I'm going to be working on, I think is Shellmound.","接下來我想我要做的是 Shellmound。"
"00:27:10,320 --> 00:27:15,400","Schafer: I think I'm going to plunge ahead with it, new stuff just to make sure no one's blocked by dialogue ever again.","Schafer：我想我要繼續往前衝，先寫新的東西，確保再也沒有人被對白卡住。"
"00:27:16,060 --> 00:27:19,480","Schafer: I hope that I get the dialogue done in the next month or two.","Schafer：希望我能在接下來一兩個月把對白寫完。"
"00:27:19,960 --> 00:27:25,645","All of it done and then it'll just be me reviewing and redesigning and rewriting stuff.","全部寫完，然後就只剩我審閱、重新設計和改寫。"
"00:27:27,560 --> 00:27:28,120","Play testing.","試玩測試。"
"00:27:29,540 --> 00:27:30,760","Schafer: Holy crap. Bailey: I know.","Schafer：天啊 我知道"
"00:27:30,760 --> 00:27:34,621","I was playing Day of the Tentacle and I was playing some of the other old games and I just noticed that","我在玩《Day of the Tentacle》和其他一些老遊戲時注意到，"
"00:27:34,621 --> 00:27:36,561","in a lot of those games there's multiple writers.","很多那類遊戲都有多位編劇。"
"00:27:37,080 --> 00:27:40,117","Is there a way to bring on a junior writer?","有沒有可能找一位 junior writer 進來？"
"00:27:40,120 --> 00:27:41,680","Schafer: I mean, I'm always open to that.","Schafer：我的意思是，我總是開放的。"
"00:27:41,680 --> 00:27:43,180","We did that on Psychonauts.","我們在《Psychonauts》就是這樣做的。"
"00:27:43,180 --> 00:27:50,480","It's just always been, it's really been hard to find people that do it exactly, exactly right.","一直以來 很難找到真正正確的人"
"00:27:50,480 --> 00:27:54,680","And it's also, it's kind of time consuming to read a bunch of writing samples.","而且看一堆寫作樣本很耗時"
"00:27:56,840 --> 00:28:04,580","It's a possibility, like if some rock star writer just walked in the door and was ready to go, I would be totally open to that.","有可能。如果某個超強編劇剛好走進門，而且準備好開工，我完全願意。"
"00:28:05,340 --> 00:28:07,860","This is where you cut to some rock star writer walking through the door.","這裡就切到某個超強編劇走進門的畫面。"
"00:28:08,060 --> 00:28:11,160","Someone that actually looks like a rock star, but he's got pen and paper.","看起來像搖滾明星 但他有筆和紙"
"00:28:12,720 --> 00:28:14,800","Petty: Would you rather have help there or in design?","Petty：你寧願在那裡或設計方面得到幫助嗎？"
"00:28:15,480 --> 00:28:19,365","Schafer: Well, design I can always get help by just having brainstorming sessions with people and having people,","Schafer：嗯，設計方面我總是可以靠和大家開腦力激盪會、找人聊來得到幫助，"
"00:28:19,365 --> 00:28:21,565","you know, to talk to and to give ideas.","你知道，談話和提供想法。"
"00:28:21,565 --> 00:28:24,445","Everybody's got like a lot of ideas to offer.","每個人都有很多想法"
"00:28:26,580 --> 00:28:30,900","Petty: We had the ax, which I presume he could just hand you.","Petty：我們有斧頭 我想他可以把斧頭交給你"
"00:28:31,860 --> 00:28:34,664","And he makes a stool, you could make here.","他做了一張凳子，你可以在這裡做。"
"00:28:34,817 --> 00:28:36,857","There's a bathroom where you get the stool.","浴室裡也有一張凳子可以拿。"
"00:28:39,720 --> 00:28:42,280","That'll be the only part of this meeting that Paul puts on the next episode.","這會是 Paul 放進下一集的這場會議唯一片段。"
"00:28:45,640 --> 00:28:48,280","Rice: Well, I mean, how are feeling?","Rice：感覺如何？"
"00:28:48,740 --> 00:28:54,340","Schafer: I think what I want to do is put all those cuts in and really just do a puzzle graph,","Schafer：我想做的是把所有那些 cut 放進去，然後真的做一張謎題圖，"
"00:28:54,340 --> 00:28:58,522","where I'm looking at all the puzzles that are in the game, and counting them and see how many we have,","看遊戲裡所有謎題，把它們算出來，看我們有多少，"
"00:28:58,522 --> 00:29:01,002","how that compares to past games and kind of hours of game play.","再和過去遊戲以及大概遊玩時數相比。"
"00:29:01,002 --> 00:29:04,321","'Cause I don't want to have a game that's like, you know, three hours long.","因為我不想做出一款只有三小時長的遊戲。"
"00:29:04,321 --> 00:29:05,961","I just want to make sure that we're still having that puzzle count...","我只是想確保我們還有那個謎題數量……"
"00:29:05,961 --> 00:29:08,698","Rice: You see, that's funny to me, because it seems like you're always complaining about long games.","Rice：你看，這對我來說很好笑，因為你好像老是在抱怨遊戲太長。"
"00:29:08,700 --> 00:29:12,765","It seems like everyone in the office enjoys short experiences.","辦公室裡的每個人似乎都喜歡短暫的經驗"
"00:29:12,765 --> 00:29:17,395","Schafer: Well, there's short and then there's like, holy crap, I can't believe they took two years to make this game.","Schafer：嗯，短是一回事，短到讓人覺得，天啊，我不敢相信他們花兩年做出這遊戲，又是另一回事。"
"00:29:17,640 --> 00:29:18,540","Rice: Yeah.","Rice：對。"
"00:29:18,540 --> 00:29:22,540","But I mean, the longer you go, the just like more dilute it gets, right?","但我的意思是，時間越拉長，就越被稀釋，對吧？"
"00:29:22,680 --> 00:29:30,754","And just in general it seems like favoring a well-polished core experience over, Schafer: I'm not talking about those kind of things.","整體來說，比起……似乎更應該偏向一個打磨好的核心體驗。Schafer：我不是在講那種事。"
"00:29:30,760 --> 00:29:31,922","I'm not talking about diluting it.","我不是說稀釋它"
"00:29:31,922 --> 00:29:34,653","I'm saying like, like we, Rice: But it's what we're doing, right?","我是說，像我們…… Rice：但這就是我們正在做的事，對吧？"
"00:29:34,653 --> 00:29:37,700","Schafer: No, i'm not, hold on- Rice: There's only a certain amount, Schafer: Shh.","Schafer：不，我不是，等一下。Rice：數量就是有限。Schafer：噓。"
"00:29:38,740 --> 00:29:39,880","Let me get this out.","讓我把話說完。"
"00:29:40,280 --> 00:29:42,010","Like Lee and I were talking, like in Stacking.","像 Lee 和我以前談《Stacking》的時候。"
"00:29:42,010 --> 00:29:43,100","We talked about Stacking.","我們談過《Stacking》。"
"00:29:43,440 --> 00:29:49,043","The content of stacking is not low, like there's tons of density and tons of characters and stuff like that.","《Stacking》的內容量並不低，裡面密度很高、角色也很多。"
"00:29:49,043 --> 00:29:55,051","And we used to talk about ways of it trying to extend, like there's content people just miss when they go through it,","我們以前會討論怎麼延伸它，像是有些內容玩家一路玩過去會錯過，"
"00:29:55,060 --> 00:30:00,882","that possibly mechanically we could have brought more into the critical path of the game, right?","也許從機制上，我們可以把更多東西拉進遊戲的關鍵路徑，對吧？"
"00:30:00,882 --> 00:30:05,682","And it always be, no matter what we do when we ship, there'll be a big call, like it's too short","而且不管我們推出時做了什麼，一定都會有人大聲說太短了。"
"00:30:05,682 --> 00:30:10,116","because people always complain about it especially adventure games being too short because they rush through them.","因為大家總是在抱怨，尤其冒險遊戲太短，因為他們一路衝過去。"
"00:30:10,120 --> 00:30:13,122","You know, some people want to rush through them, and then they're like, ah, it's too short.","你知道，有些人就是想衝完，然後又說，啊，太短了。"
"00:30:13,122 --> 00:30:15,069","Rice: I do think it's a recent phenomenon, though.","Rice：但我覺得這是最近的事"
"00:30:15,069 --> 00:30:17,920","People arguing the other way.","人們在爭吵"
"00:30:17,920 --> 00:30:19,440","Schafer: We're not going to be able to make this game too long.","Schafer：我們不可能把這遊戲做得太長。"
"00:30:19,440 --> 00:30:26,470","There's nothing we can do to make this game feel too long or be too long, because you just cannot extend that content, that's hand-made in that way.","我們沒有任何辦法讓這遊戲感覺太長或真的太長，因為那種手工內容根本沒辦法這樣延展。"
"00:30:26,470 --> 00:30:29,900","We have no systems that we could accidentally turn the screws on and all of a sudden make it.","我們沒有哪個系統可以不小心把強度轉高，突然就變長。"
"00:30:30,080 --> 00:30:33,340","Rice: Yeah, I guess I'm just, don't see it as an issue if it feels short.","Rice：對，我想我只是覺得，如果它感覺短，這不算問題。"
"00:30:34,060 --> 00:30:35,057","Schafer: I do, but I do.","Schafer：我願意，但我願意"
"00:30:35,060 --> 00:30:36,720","I think there's a certain value proposition.","我覺得有某種價值主張在。"
"00:30:36,971 --> 00:30:45,251","Like a ripped off feeling if it's not, you know, there's definitely a minimum.","如果沒有達到，你知道，確實會有一種被坑的感覺，肯定有個最低限度。"
"00:30:45,620 --> 00:30:52,772","Rice: We only have so much money to spend and so much time on this game, so like, the more content we put in, the less time we have to polish it.","Rice：我們能花在這遊戲上的錢和時間就這麼多，所以內容放得越多，能打磨的時間就越少。"
"00:30:52,780 --> 00:30:54,132","So it's a delicate balance.","所以這是很微妙的平衡。"
"00:30:54,140 --> 00:31:00,368","But I think he's just, he just doesn't want us to like finish and we do a full play-test of the game and it's like two hours long.","但我覺得他只是，他只是不希望我們做完後完整試玩一次，結果遊戲只有兩小時。"
"00:31:00,520 --> 00:31:04,943","And it just feels empty, but like, there's no way that's going to happen.","而且感覺很空；但那絕對不可能發生。"
"00:31:04,943 --> 00:31:11,282","Like I'm, I'm pretty sure it's going to be like 8, 10 hours, just based on what we've seen.","就我看過的東西來說，我很確定它會有八到十小時。"
"00:31:11,282 --> 00:31:15,093","Rice: Yeah, and I think Full Throttle's the one specifically people always call out to him,","Rice：對，而且我覺得大家特別常對他提起的是《Full Throttle》。"
"00:31:15,100 --> 00:31:22,620","and I think it is, 'cause it is a more like linear narrative kind of, like I don't feel like I got stuck a ton in Full Throttle.","我覺得是，因為它比較像線性敘事；我不覺得我在《Full Throttle》卡關很多。"
"00:31:22,880 --> 00:31:26,640","And I don't think anyone who'd play it now would say it's short.","我覺得沒人會說它很短"
"00:31:27,600 --> 00:31:31,293","Rice: We are making an 8, 10 hour game maybe, who knows?","Rice：我們也許正在做一款八到十小時的遊戲，誰知道？"
"00:31:31,300 --> 00:31:36,089","But like either way, we're making an hour of music so it's not going to fill the whole game.","但不管怎樣，我們只做一小時音樂，所以不可能填滿整款遊戲。"
"00:31:36,089 --> 00:31:42,000","So does that mean we have parts that don't have music?","那意味著我們有部分沒有音樂嗎？"
"00:31:42,000 --> 00:31:43,540","That rely on ambience?","那表示有些部分要靠環境音嗎？"
"00:31:43,840 --> 00:31:50,221","Does that mean we write extra music like we did with Cloud Colony?","那表示我們要像 Cloud Colony 那樣多寫一些音樂嗎？"
"00:31:50,221 --> 00:31:54,201","But it seems like there's conflicting opinions between people on the team.","但團隊裡大家的意見似乎有衝突。"
"00:31:56,640 --> 00:31:58,580","Schafer: Between Brian and Peter? Rice: Yeah.","Schafer：布萊恩和彼得之間？是的"
"00:31:59,140 --> 00:32:03,401","Min: It's just that things like we have the Cloud Colony, for example, where we made changes, McConnell: Right.","Min：只是像 Cloud Colony 這種地方，我們做了修改。McConnell：對。"
"00:32:03,401 --> 00:32:06,334","Min: so like, you know, a month goes by, we have to keep moving.","Min：所以，你知道，一個月過去，我們必須繼續前進。"
"00:32:06,340 --> 00:32:14,129","But you know, we couldn't get feedback from you so there's inefficiencies there so, McConnell: I think, but I didn't know there was feedback to give.","但你知道，我們拿不到你的回饋，所以就有效率不佳的地方。McConnell：我想，但我不知道有回饋要給。"
"00:32:14,129 --> 00:32:21,802","I think we, I do think we need to revisit the Cloud Colony stuff because quite honestly, the new version doesn't work for me.","我確實覺得我們得重新看 Cloud Colony 的東西，因為老實說，新版本對我來說不成立。"
"00:32:21,802 --> 00:32:23,572","It feels too fast.","感覺太快了"
"00:32:23,580 --> 00:32:26,317","It doesn't feel drifty and floaty anymore.","不再有漂浮的感覺"
"00:32:26,320 --> 00:32:30,649","And you know, I ran it by Tim and he felt the same way.","你知道，我拿給 Tim 看過，他也有同樣感覺。"
"00:32:30,649 --> 00:32:36,695","Min: You have to understand where I'm coming from, I'm trying to meet deadlines to make sure that we have certain things, certain momentum.","Min：你得理解我的立場，我是在試著趕期限，確保我們有某些東西、某種進度。"
"00:32:36,700 --> 00:32:41,317","So the creative feedback is nothing personal, we're not trying to inject our own kind of thing.","所以創意回饋不是針對個人，我們不是想塞進自己的東西。"
"00:32:41,320 --> 00:32:42,205","McConnell: Well, Brian, listen.","McConnell：布萊恩 聽著"
"00:32:42,205 --> 00:32:43,085","I understand totally.","我完全理解"
"00:32:43,085 --> 00:32:44,335","You were just trying to solve a problem.","你只是想解決一個問題"
"00:32:44,340 --> 00:32:45,649","Min: Yes. That's exactly right.","Min：是的 沒錯"
"00:32:45,649 --> 00:32:51,215","McConnell: The responsibility for not checking the game sooner, it'll never happen again.","McConnell：沒有更早檢查遊戲，責任在我，這不會再發生了。"
"00:32:51,220 --> 00:32:57,180","Stoddard: Well, clearly the workflow needs better communication from here on out, between the four of us.","Stoddard：很明顯，從現在開始，我們四個人的工作流程需要更好的溝通。"
"00:32:57,180 --> 00:32:58,340","McConnell: Yeah, totally.","McConnell：是的，完全。"
"00:32:58,740 --> 00:33:07,273","Stoddard: Pete is contracted only for a certain amount of music and we have to find a way to stretch it out,","Stoddard：Pete 的合約只包含一定量的音樂，我們得想辦法把它延展開來，"
"00:33:07,280 --> 00:33:09,878","because the game's going to need a lot more time than that.","因為遊戲需要的時間會多很多。"
"00:33:09,880 --> 00:33:13,958","McConnell: You know, how do you cover, how do you cover all the ground that you need to cover?","McConnell：你知道，要怎麼涵蓋，怎麼涵蓋所有需要涵蓋的範圍？"
"00:33:13,960 --> 00:33:18,152","I mean, that's really what's behind this question, right? Min: Yeah.","我是說，這才是問題的背後，對吧？對。"
