"Timecode","Content","Content_zh"
"00:21:23,100 --> 00:21:30,223","Like I think, I still think it's very important that even though you're very, very limited in your budget, it's important to take the time out.","我還是覺得，就算預算非常非常有限，花時間做這件事也很重要。"
"00:21:30,377 --> 00:21:31,360","We can't do everything.","我們不可能什麼都做。"
"00:21:31,360 --> 00:21:37,000","We can't do Foley for everything, but on some of these kinds of things that the player hears a lot,","不可能每樣東西都做 Foley，但有些玩家常聽到的東西，"
"00:21:37,000 --> 00:21:40,359","which are footsteps, we try to be very specific and custom.","像腳步聲，我們會盡量做得很精準、很客製化。"
"00:21:40,360 --> 00:21:41,511","And then I think that's important.","我覺得那很重要。"
"00:21:41,520 --> 00:21:46,200","So even if you're super on a shoestring budget, you can see we can do things in some office.","所以就算預算超緊，也能看到我們可以在辦公室裡完成一些東西。"
"00:21:46,502 --> 00:21:51,440","Not the best acoustic treatment or whatnot, but we try to track those things organically and I think that has a lot of value.","聲學處理不算最好，但我們盡量自然地錄下那些聲音，我覺得很有價值。"
"00:21:51,440 --> 00:21:53,140","So yeah.","所以，對。"
"00:21:53,600 --> 00:21:59,866","Stoddard: But yeah, that's, that's been the cool thing about working on this game, is 'cause like it just covers a lot of ground.","Stoddard：對，這就是做這款遊戲很酷的地方，因為它涵蓋的範圍很廣。"
"00:22:00,240 --> 00:22:01,666","There's a lot of stuff going on.","裡面有很多東西在發生。"
"00:22:01,666 --> 00:22:10,860","And Pete and I have been having discussions about that, 'cause he called me up and he was like, you know, I played through the game.","Pete 和我一直在討論這點，因為他打電話給我說，他玩完了遊戲。"
"00:22:11,160 --> 00:22:19,396","I'm like seeing what Tim's trying to say and all the coming of age stuff and he's like, I don't know what cereal he was eating, but this is like insanely good.","他說他看得出 Tim 想表達什麼，還有那些成長主題，然後說，我不知道他吃了什麼麥片，但這真的好到誇張。"
"00:22:19,586 --> 00:22:23,606","And like he's like, I'm going to have to go all over the board with music.","他說音樂上得涵蓋非常廣的範圍。"
"00:22:23,900 --> 00:22:28,480","McConnell: So here's everything we're doing in two sessions.","McConnell：這是我們兩次錄音要做的全部內容。"
"00:22:30,680 --> 00:22:34,880","It looks like a mess, but it's actually, here's the cues prioritized.","看起來很亂，但其實這裡是依優先順序排好的 cue。"
"00:22:35,120 --> 00:22:41,680","Here's the amount of time that actually the sextet has to record.","這是六重奏實際能錄音的時間。"
"00:22:42,360 --> 00:22:47,680","And then that's translated into how much session time we can afford for each cue.","然後換算成每個 cue 我們負擔得起多少錄音時間。"
"00:22:48,320 --> 00:22:51,280","And hence this.","所以就變成這樣。"
"00:22:51,820 --> 00:22:55,020","It's very simple, you're just you know, playing a couple notes.","很簡單，你們只是演奏幾個音。"
"00:22:55,080 --> 00:22:59,420","We just need to get them, we just need to get it all happen.","我們只需要把它們錄起來，讓整件事完成。"
"00:23:00,860 --> 00:23:06,860","McConnell: We put down all the small ensemble music for Broken Age on track, on tape.","McConnell：我們把《Broken Age》所有小編制樂曲都錄下來了。"
"00:23:07,360 --> 00:23:08,840","I always, I still say tape.","我還是會說錄到帶子上。"
"00:23:09,840 --> 00:23:11,360","I still say records, too.","我也還是會說唱片。"
"00:23:11,460 --> 00:23:21,014","[Music] McConnell: Like this story is so wonderful because it's so complex.","[音樂] McConnell：這個故事很棒，因為它很複雜。"
"00:23:21,255 --> 00:23:26,560","It's, you know, it's not just, oh yeah, the young people know everything and the old people screwed up the world, you know.","它不是那種，喔對，年輕人什麼都懂，老人把世界搞砸了。"
"00:23:26,680 --> 00:23:28,620","No, it's not, it's not quite like that, is it?","不，不是，不完全是那樣，對吧？"
"00:23:28,940 --> 00:23:31,220","No, the young people don't know everything.","不是，年輕人並不是什麼都懂。"
"00:23:31,560 --> 00:23:36,860","Maybe the, maybe the grownups have been through some things, you know.","也許大人也經歷過一些事情。"
"00:23:37,297 --> 00:23:50,960","And yet there may, they've made terrible mistakes and I think that, that is really fun to engage musically.","但他們也可能犯下很糟的錯，而我覺得用音樂去處理這點很有趣。"
"00:23:51,300 --> 00:23:52,880","McConnell: I don't know much about Part Two.","McConnell：我對第二部分了解不多。"
"00:23:53,680 --> 00:23:55,380","I've been told things, you know.","有人跟我說過一些事。"
"00:23:55,380 --> 00:24:02,760","I've been told, you know, that there's a, I've been told a rundown of it but honestly, what I've been told I don't entirely understand right now.","有人跟我講過大綱，但老實說，我現在還不是完全懂。"
"00:24:04,140 --> 00:24:13,500","And you know, I think that's, I think that's really good, because the score is going to discover what Part Two is when Part Two happens.","而我覺得這很好，因為配樂會在第二部分發生時，自己去發現第二部分是什麼。"
"00:24:14,360 --> 00:24:32,020","[Music] McConnell: That was janky.","[音樂] McConnell：剛才有點不穩。"
"00:24:32,020 --> 00:24:35,568","[Music] I think we have that in an earlier take.","[音樂] 我想前面某次 take 有錄到那個。"
"00:24:37,180 --> 00:24:40,800","McConnell: It's a, it's a real score for a real, for a real story.","McConnell：這是真正的故事，需要真正的配樂。"
"00:24:41,260 --> 00:24:44,240","I think it's, it's kind of a labor of love for everybody.","我覺得這對大家來說，有點像是出於熱愛的作品。"
"00:24:44,440 --> 00:24:46,640","I think it's really, really what it gets down to.","我想說到底就是這樣。"
"00:24:46,960 --> 00:24:57,965","It's this, you know, people get excited about, about working on a project and you know, in this day and age the people who you happen to run across,","就是人們會因為參與一個專案而興奮，而在這個時代，你偶然遇到的人，"
"00:24:58,084 --> 00:25:04,784","who get excited about working with you and you're able to, to put something together with them, might be on another continent.","那些很想和你合作、能一起做出東西的人，可能在另一個大陸。"
"00:25:05,100 --> 00:25:26,620","[Music] [Orchestra warming up]","[音樂] [管弦樂團暖身]"
"00:25:26,780 --> 00:25:28,600","Pogson: Yeah, so this was, this was pretty exciting.","Pogson：對，所以這真的滿令人興奮的。"
"00:25:29,100 --> 00:25:38,769","I guess the interesting thing about the MSO being involved is the fact that I'm actually a Kickstarter backer of the game","我想 MSO 參與其中有趣的地方，是我其實是這款遊戲的 Kickstarter 贊助者，"
"00:25:38,769 --> 00:25:43,942","and I was well before I'd ever spoken to Peter and well before this project came on our radar.","而且是在我跟 Peter 說話之前很久，也是在這個專案進入我們視野之前很久。"
"00:25:43,942 --> 00:25:52,529","Pogson: Really all of Tim's games and certainly Peter's scores are pretty much all of my favorite games from my childhood.","Pogson：Tim 的所有遊戲，當然還有 Peter 的配樂，幾乎都是我童年最喜歡的遊戲。"
"00:25:53,040 --> 00:25:59,454","They're games I spent huge numbers of hours with my friends playing as little kids.","那些是我小時候和朋友花了大量時間玩的遊戲。"
"00:25:59,657 --> 00:26:08,000","So much so that things like Day of the Tentacle and certainly later on things like The Dig and Grim Fandango","像《Day of the Tentacle》，當然還有後來的《The Dig》和《Grim Fandango》，"
"00:26:08,000 --> 00:26:15,372","and all of those old LucasArts games, we used to act, when little kids playing around playgrounds,","以及那些 LucasArts 老遊戲，我們小時候在操場玩時，"
"00:26:15,380 --> 00:26:19,034","we used to sort of almost act out the puzzles.","幾乎會把那些謎題演出來。"
"00:26:19,163 --> 00:26:23,063","So for me, those LucasArts games are a real nostalgia trip.","所以對我來說，那些 LucasArts 遊戲真的很懷舊。"
"00:26:23,960 --> 00:26:27,820","And they just really remind me of those, those days when we were younger.","它們真的會讓我想起我們年輕時的那些日子。"
"00:26:27,960 --> 00:26:35,132","And then I was watching one of the backer videos and saw that Peter was mentioned.","後來我看了一支贊助者影片，看到影片裡提到 Peter。"
"00:26:35,282 --> 00:26:40,680","It actually wasn't far before any of the episodes about Peter really being involved.","那其實是在真正談到 Peter 參與的集數之前沒多久。"
"00:26:40,851 --> 00:26:42,520","But I thought, oh, wow!","但我想，哇！"
"00:26:42,520 --> 00:26:47,749","Peter's in this, which makes total sense because him and Tim have worked together for a very long time and I hadn't really thought about it.","Peter 也在裡面，這完全合理，因為他和 Tim 合作很久了，而我之前真的沒想到。"
"00:26:47,882 --> 00:26:50,102","And I sort of thought, you know what?","然後我就想，你知道嗎？"
"00:26:50,540 --> 00:26:52,800","I wonder if there's an orchestra recording there.","不知道這裡會不會有管弦樂錄音。"
"00:26:52,800 --> 00:26:55,920","So I had no idea whether they were having a proper orchestra do it.","所以我完全不知道他們會不會找正式管弦樂團來做。"
"00:26:56,340 --> 00:26:58,920","Obviously I had access to an orchestra.","而我剛好能接觸到一個管弦樂團。"
"00:26:59,100 --> 00:27:00,920","Conductor: So good morning, everyone. Thanks for being here.","Conductor：各位早安，謝謝大家來。"
"00:27:01,320 --> 00:27:03,020","This is for a video game.","這是遊戲的錄音。"
"00:27:03,880 --> 00:27:06,998","We're working with Peter McConnell, a composer who's in L.A.","我們會和洛杉磯的作曲家 Peter McConnell 合作。"
"00:27:07,000 --> 00:27:10,320","and he's on the line now and we'll be talking with him as we go.","他現在在線上，我們會邊錄邊和他溝通。"
"00:27:11,140 --> 00:27:15,620","Upstairs we've got Hai, Chris and Nick and we've got a fair bit to do.","樓上有 Hai、Chris 和 Nick，我們有不少事情要做。"
"00:27:15,620 --> 00:27:16,900","So that's enough talking for now.","所以現在先說到這裡。"
"00:27:16,900 --> 00:27:21,220","We're going to start with SM03, Shellmound Battle.","我們從 SM03，Shellmound Battle 開始。"
"00:27:21,460 --> 00:27:45,380","[Music] McConnell: Love that tuba.","[音樂] McConnell：我愛那個低音號。"
"00:27:45,940 --> 00:29:11,411","[Music] Pogson: Stop there, mate.","[音樂] Pogson：停在那裡，兄弟。"
"00:29:11,880 --> 00:29:14,580","Turn back to trombone and tuba and move ahead there.","回到長號和低音號，然後從那裡往前。"
"00:29:14,580 --> 00:29:16,460","We've just got to go with the one note.","我們只要用那一個音。"
"00:29:24,160 --> 00:29:25,260","McConnell: Perfect.","McConnell：完美。"
"00:29:27,480 --> 00:29:54,533","[music slowly builds in intensity] Pogson: I really admire any game that puts music, you know,","[音樂慢慢增強] Pogson：我真的很欣賞把音樂當成重要元素的遊戲。"
"00:29:54,540 --> 00:29:56,314","as a really important element of the game.","把它當成遊戲裡非常重要的元素。"
"00:29:56,480 --> 00:30:00,590","There are so many games, even really big budget ones, and some of the biggest budget ones,","有太多遊戲，就算是大預算，甚至是最大規模預算的遊戲，"
"00:30:00,590 --> 00:30:03,552","where you can just tell that they haven't used real musicians.","你一聽就知道他們沒有用真正的樂手。"
"00:30:03,675 --> 00:30:09,858","Yes, they're very high quality samples and so on and perhaps there are people who don't notice the difference.","對，那些 sample 品質很高之類的，也許有人聽不出差別。"
"00:30:09,858 --> 00:30:11,438","But I always do.","但我永遠聽得出來。"
"00:30:11,438 --> 00:30:18,516","And I think the really great part about this is that, I'm actually very proud that we're able to bring that,","而我覺得這件事最棒的地方是，我其實很自豪我們能把那種"
"00:30:18,516 --> 00:30:24,877","that full orchestra palette and that authentic sound to a project like this.","完整的管弦樂色彩和真實聲響帶到這樣的專案裡。"
"00:30:24,877 --> 00:30:35,618","And I think Peter was very, very pleased as well because talking to him, it was always a dream of his to be able to use a proper orchestra for this.","我想 Peter 也非常非常高興，因為跟他聊時，他一直夢想能為這個作品用正式管弦樂團。"
"00:30:35,618 --> 00:30:39,606","And, but didn't think it was going to happen and now it has.","但他原本不覺得會成真，而現在成真了。"
"00:30:39,606 --> 00:30:44,885","And I think it's important to me, as a backer, as well to have that, that level of quality on there.","身為贊助者，我也覺得能有這種品質很重要。"
"00:30:44,885 --> 00:30:45,685","So it's great.","所以很棒。"
"00:30:45,685 --> 00:30:46,665","Should be good.","應該會很不錯。"
"00:30:46,900 --> 00:31:12,160","[Music] Conductor: Thanks Brett.","[音樂] Conductor：謝謝 Brett。"
"00:31:15,420 --> 00:31:17,640","Thanks brass, woodwinds. Thank you. Fantastic.","謝謝銅管、木管。謝謝。太棒了。"
"00:31:20,520 --> 00:31:22,520","McConnell: I cannot believe we got that.","McConnell：真不敢相信我們錄到了。"
"00:31:26,020 --> 00:31:27,290","Stoddard: Awesome.","Stoddard：太棒了。"
"00:31:27,290 --> 00:31:28,782","Anything else.","還有別的嗎？"
"00:31:28,782 --> 00:31:30,662","McConnell: No, let's get a beer.","McConnell：沒有，我們去喝啤酒吧。"
"00:31:31,980 --> 00:31:34,200","Stoddard: This is the Shellmound Battle.","Stoddard：這是 Shellmound Battle。"
"00:31:34,403 --> 00:31:41,560","[Music] Gardner: It reminds me of Goonies.","[音樂] Gardner：這讓我想到《The Goonies》。"
"00:31:42,520 --> 00:31:43,630","It's like that.","就是那種感覺。"
"00:31:43,630 --> 00:31:45,610","It's like Jaws, but by Elfman.","像《Jaws》，但由 Elfman 來寫。"
"00:31:46,822 --> 00:32:05,400","[Music] Ryken: That's what they're going to play when we get the Game of the Year.","[音樂] Ryken：等我們拿年度遊戲時，他們就會放這首。"
"00:32:06,680 --> 00:32:07,978","Rice: That one's so good!","Rice：那首太棒了！"
"00:32:07,980 --> 00:32:08,860","Gardner: Amazing.","Gardner：超棒。"
"00:32:09,260 --> 00:32:11,000","Stoddard: The only other one we have...","Stoddard：我們唯一另一首……"
"00:32:11,000 --> 00:32:15,041","Gardner: I still wish all the animation was done before you guys, Stoddard: Well, that's what's happening with this one.","Gardner：我還是希望所有動畫都能在你們錄音前完成。Stoddard：嗯，這首就是這樣。"
"00:32:15,041 --> 00:32:18,561","This is for the final scene, which I think Elliot's working on right now.","這是最後一幕用的，我想 Elliot 現在正在做。"
"00:32:19,040 --> 00:32:26,851","Stoddard: Basically, the symphonic recording, live instruments and pro voices all like happening at the same time,","Stoddard：基本上，交響樂錄音、現場樂器和專業配音全都擠在同一時間，"
"00:32:26,880 --> 00:32:29,560","which is creating quite an amazing bottleneck.","造成了相當驚人的瓶頸。"
"00:32:29,740 --> 00:32:36,624","But it's also kind of communicating with Tim and with production and with the animators,","但這也牽涉到和 Tim、製作團隊以及動畫師溝通，"
"00:32:36,624 --> 00:32:42,184","because a lot of that stuff is still being worked on visually.","因為很多東西在視覺上仍然還在製作。"
"00:32:42,600 --> 00:32:50,530","Crook: I've been doing all the play blasts for all of the spaceship cut scenes, so that we can have a meeting with animators","Crook：我一直在做所有太空船過場動畫的 playblast 預覽，好讓我們能和動畫師開會，"
"00:32:50,530 --> 00:32:57,820","and you and go over what we might want to change before we move into final animation on those.","你也一起來，在進入最終動畫前檢視有哪些可能要改。"
"00:32:59,129 --> 00:33:00,823","Offscreen Voice: My name is Marek.","畫外音：我叫 Marek。"
"00:33:00,823 --> 00:33:04,183","And what I'm about to show you is no game.","而我接下來要給你看的，不是遊戲。"
"00:33:04,460 --> 00:33:05,920","Schafer: What are those hairs?","Schafer：那些毛是什麼？"
"00:33:12,485 --> 00:33:13,925","Marek: There will always be war.","Marek：戰爭永遠都會存在。"
"00:33:13,925 --> 00:33:15,505","We did not start it.","不是我們挑起的。"
"00:33:17,400 --> 00:33:21,242","Marek: What we can do is protect the weak and rescue the helpless.","Marek：我們能做的，是保護弱者，拯救無助的人。"
"00:33:22,700 --> 00:33:26,667","Schafer: I think the animation of the wolf is hilarious and it's great but it's a little out of character for Marek.","Schafer：我覺得狼的動畫很好笑也很棒，但對 Marek 來說有點不符合角色。"
"00:33:26,667 --> 00:33:32,770","Like Marek is so somber and serious, but when he's like putting his arm around him and like it seems really jovial and stuff like that.","Marek 很陰沉嚴肅，可是他把手搭在他肩上時，看起來很歡樂之類的。"
"00:33:32,770 --> 00:33:40,137","And Marek is like this, I always saw him as more just like super-intense, brooding, like intimidating kind of guy, like that.","我一直覺得 Marek 更像是氣場很強、陰鬱、帶點威嚇感的人。"
"00:33:40,140 --> 00:33:43,580","Like he's a little too chummy in this, especially the beginning of it.","這裡他有點太親切了，尤其是一開始。"
"00:33:45,938 --> 00:33:48,779","Crook: One, just, tear runs down Dave's cheek.","Crook：一滴淚，就這樣從 Dave 臉頰滑下來。"
"00:33:48,779 --> 00:33:53,120","Gardner: I mean, part of it is that he's supposed to be selling the boy on this whole deal,","Gardner：我是說，部分原因是他本來就要說服那孩子接受整件事，"
"00:33:53,120 --> 00:33:57,532","that's why I was trying to, Schafer: But he's not selling him like, like hey buddy.","所以我才想要……Schafer：但他不是用那種，嘿，老兄的方式說服他。"
"00:33:57,540 --> 00:34:00,135","He's not like Bruce Campbell, like he's not, I don't about Bruce Campbell.","他不像 Bruce Campbell，不是那樣，我不是在說 Bruce Campbell。"
"00:34:00,140 --> 00:34:06,362","But like he's not like, he doesn't have that kind of charlatan sounding salesman-y tone to his voice.","但他不是那種江湖騙子、推銷員式的語氣。"
"00:34:06,362 --> 00:34:07,795","And it's not, like his character.","那也不是他的角色。"
"00:34:07,800 --> 00:34:10,536","He's more just like, Gardner: Can I see it again?","他比較像是……Gardner：我可以再看一次嗎？"
"00:34:10,540 --> 00:34:14,320","Schafer: Are you good enough for this mission kind of like.","Schafer：像是，你夠格執行這個任務嗎？"
"00:34:15,320 --> 00:34:16,954","He's got a coldness to him that I think...","他有種冷感，我覺得……"
"00:34:16,960 --> 00:34:19,708","Gardner: I really hate to lose all that, like stuff.","Gardner：我真的很不想失去那些東西。"
"00:34:19,708 --> 00:34:21,725","'Cause it's just, I don't know, I'm happy with it there.","因為我不知道，我很喜歡那段。"
"00:34:21,725 --> 00:34:22,780","Schafer: But it's a little too goofy.","Schafer：但它有點太滑稽了。"
"00:34:22,780 --> 00:34:28,439","I would say overall the whole thing's a little too goofy, so I feel like it all, it needs a sombering pass on the whole thing, you know, for sure.","整體來說我會說它有點太滑稽，所以我覺得整段都需要再調得陰沉一點。"
"00:34:28,440 --> 00:34:30,180","Just to make his character correct.","讓他的角色感覺對味。"
"00:34:31,900 --> 00:34:34,580","Gardner: I could cut out the like arm over the shoulder part.","Gardner：我可以把手搭肩膀那段剪掉。"
"00:34:35,368 --> 00:34:37,168","And I think we should cut all this stuff out.","而且我覺得我們應該把這些全剪掉。"
"00:34:37,168 --> 00:34:38,051","Marek: There will always be war.","Marek：戰爭永遠都會存在。"
"00:34:38,199 --> 00:34:39,562","We did not start it and we cannot stop it.","不是我們挑起的，我們也阻止不了它。"
"00:34:41,540 --> 00:34:43,508","Gardner: As much as I don't want to do that, 'cause it's amazing.","Gardner：雖然我很不想那麼做，因為它很棒。"
"00:34:44,179 --> 00:34:45,801","Schafer: I think it's all great, but let's get one thing clear.","Schafer：我覺得都很棒，但我們先講清楚一件事。"
"00:34:45,802 --> 00:34:47,772","I think it all totally needs to be changed.","我覺得整段都完全需要改。"
"00:34:47,780 --> 00:34:49,975","I do think it's a totally wrong take on his character.","我真的覺得這完全抓錯了他的角色詮釋。"
"00:34:49,980 --> 00:34:51,316","That's what I'm saying.","這就是我要說的。"
"00:34:51,320 --> 00:34:54,316","So we, so I don't want to just kind of like do a couple tweaks here and there.","所以我不想只是到處小修幾下。"
"00:34:54,320 --> 00:34:59,120","I think, we have to understand that he's supposed to be cold and calculating and a little scary.","我覺得我們得理解，他應該是冷酷、精於算計，而且有點嚇人。"
"00:34:59,120 --> 00:35:03,809","And these make him seem really friendly, like now you've met your new best friend, which he's kind of like not there yet.","而這些讓他看起來很友善，像是你剛認識了新的好朋友，但他還沒到那個階段。"
"00:35:03,809 --> 00:35:09,209","Like he's not, Gardner: I mean, yeah. OK.","他不是……Gardner：我是說，對。好。"
"00:35:11,160 --> 00:35:13,602","Schafer: Were you here that day that I had to tell Dave to reanimate that scene?","Schafer：我那天叫 Dave 重做那場戲時，你在嗎？"
"00:35:13,602 --> 00:35:14,764","That was exciting.","那真是刺激。"
"00:35:15,400 --> 00:35:16,520","Schafer: Oh, good.","Schafer：喔，很好。"
"00:35:16,900 --> 00:35:20,829","That's like one of the worst or hardest parts about doing like a creative collaboration with anyone.","這大概就是和任何人做創意合作時，最糟或最難的部分之一。"
"00:35:20,829 --> 00:35:28,540","You have this great artist and creative people from different disciplines and they'll do something that's just amazing and everybody loves it.","你有很棒的藝術家，還有來自不同領域的創意人，他們做出很驚人的東西，大家都很喜歡。"
"00:35:28,860 --> 00:35:34,014","And by itself it's a great work of art, like that piece of animation or a piece of music or something.","它本身是一件很棒的藝術作品，像那段動畫、一段音樂或其他東西。"
"00:35:34,020 --> 00:35:37,030","But then you go like, but that doesn't fit into this larger thing.","但接著你會說，可是它不適合放進這個更大的整體裡。"
"00:35:37,030 --> 00:35:40,321","That is wrong for the thing that I'm trying to do with this bigger thing.","它不符合我想用這個更大作品做的事。"
"00:35:40,449 --> 00:35:42,423","So take that, all that work you did and throw it away.","所以你得把你做的那些心血全拿走，丟掉。"
"00:35:42,423 --> 00:35:48,883","That's the worst part about it, but you kind of have to do that or else you have everything going in all different directions.","那是最糟的部分，但你就是得這麼做，不然所有東西都會往不同方向跑。"
"00:35:50,560 --> 00:35:52,149","Schafer: So, sorry.","Schafer：所以，抱歉。"
"00:35:52,149 --> 00:35:53,665","It all was really cool.","那些真的都很酷。"
"00:35:53,665 --> 00:35:55,345","I'm just here to take out things people like.","我只是來把大家喜歡的東西拿掉的。"
"00:35:55,345 --> 00:36:01,161","Gardner: It'll, it'll, like we'll have it, like I have a movie file of it, so like ten years from now I can be like, look how wrong Tim was.","Gardner：沒關係，我們會留著，我有它的影片檔，所以十年後我可以說，看 Tim 錯得多離譜。"
"00:36:03,440 --> 00:36:04,901","Offscreen Voice: Did you guys fix this yet?","畫外音：你們修好這個了嗎？"
"00:36:04,901 --> 00:36:07,165","Gardner: Yeah. We're good.","Gardner：對。我們好了。"
"00:36:08,380 --> 00:36:11,280","Gardner: So you can see this is a long cut scene.","Gardner：所以你可以看到，這是一段很長的過場動畫。"
"00:36:11,284 --> 00:36:12,924","Four thousand frames long.","有四千個影格長。"
"00:36:14,620 --> 00:36:17,387","Straight through all of it.","整段一路到底。"
