"Timecode","Content","Content_zh"
"00:10:12,080 --> 00:10:13,780","Kind of like that HOF that we did.","有點像我們做過的 HOF。"
"00:10:14,700 --> 00:10:16,485","But these were actually just watching someone.","但這些其實就是單純看著某個人玩。"
"00:10:16,485 --> 00:10:21,139","And watching what they do with the cursor, like oh, they put the cursor over the right spot but they didn't click.","看他們怎麼操作游標，像是，喔，他們把游標移到正確位置了，但沒有點。"
"00:10:21,140 --> 00:10:22,517","Why didn't they do that?","他們為什麼不點？"
"00:10:22,520 --> 00:10:26,560","And, or they'll, the object you want them to touch is here and they'll go all around the room this way.","或者你想讓他們碰的物件就在這裡，他們卻繞著房間到處跑。"
"00:10:26,560 --> 00:10:27,742","And like, what are they doing?","然後你會想，他們在幹嘛？"
"00:10:27,900 --> 00:10:28,734","Why are they doing that?","他們為什麼這樣做？"
"00:10:28,740 --> 00:10:29,540","That's so crazy.","這太瘋狂了。"
"00:10:30,940 --> 00:10:36,300","And just noticing when they're tapping their fingers and when they're, you know, laughing and all that stuff is really fascinating.","還有觀察他們什麼時候敲手指、什麼時候笑，這些都真的很有趣。"
"00:10:37,180 --> 00:10:42,453","Rice: Yeah, we've kind of had a little cadence to it, so it just started with people internal who are really kind of into,","Rice：對，我們有點照著節奏來，一開始是找公司內部那些真的很投入、"
"00:10:42,460 --> 00:10:44,840","to adventure games specifically.","尤其喜歡冒險遊戲的人。"
"00:10:45,700 --> 00:10:52,145","Just because they'll be a little more keen to kind of understand what's the goal and what they're trying to do.","因為他們比較能理解目標是什麼、自己該做什麼。"
"00:10:52,145 --> 00:10:54,905","Remo: I like that the ship design is like very interlocking.","Remo：我喜歡這艘船的設計很環環相扣。"
"00:10:55,780 --> 00:11:00,377","Like I still don't go to the like most optimum way every time, because I don't always remember where everything goes,","我還是不會每次都走最理想的路線，因為我不一定記得所有地方通到哪裡，"
"00:11:00,380 --> 00:11:07,720","but I feel like I'm starting to actually understand the space and how it's spatially connected, which is a really good feeling to have in a game.","但我覺得自己開始真的理解這個空間，以及它在空間上怎麼連接，這在遊戲裡是很棒的感覺。"
"00:11:08,800 --> 00:11:11,060","Kipnis: So what are you trying to get accomplished?","Kipnis：所以你現在想達成什麼？"
"00:11:11,260 --> 00:11:18,000","Remo: I mean, I, getting out of range of the mom arm when I'm trying to get to the boom arm.","Remo：我是說，我想在要去吊臂時，先離開媽媽手臂的範圍。"
"00:11:18,380 --> 00:11:24,220","And then get the weaver to go to the correct location.","然後讓 Space Weaver 去正確的位置。"
"00:11:24,540 --> 00:11:25,700","Kipnis: What is that for, though?","Kipnis：可是那是為了什麼？"
"00:11:32,240 --> 00:11:35,620","Remo: Save guys, I don't remember. Sorry.","Remo：救人吧，我不記得了。抱歉。"
"00:11:37,140 --> 00:11:38,720","Yeah, I can't remember offhand.","對，我一時想不起來。"
"00:11:39,360 --> 00:11:44,740","Rice: Now we kind of started opening it up internally to more people who don't particularly play this kind of a game.","Rice：現在我們開始在內部開放給更多不太玩這類遊戲的人。"
"00:11:47,700 --> 00:11:51,100","Sullivan: Yeah, I could maybe, should come around the side?","Sullivan：對，我也許可以，應該從旁邊繞過去？"
"00:11:51,100 --> 00:11:52,240","Gollaher: How do you do it? Yeah, exactly.","Gollaher：你要怎麼做？對，沒錯。"
"00:11:52,240 --> 00:11:53,600","That's what I'm trying to figure out.","這就是我在想的。"
"00:11:54,520 --> 00:11:56,486","Sullivan: I don't see any like connection back here.","Sullivan：我看不出這裡後面有什麼連接。"
"00:11:56,486 --> 00:11:59,546","Gollaher: So there's, yeah, but there's a path up there.","Gollaher：所以那裡，對，但上面有一條路。"
"00:12:09,620 --> 00:12:11,240","I don't know where else to go.","我不知道還能去哪裡。"
"00:12:11,240 --> 00:12:12,298","Sullivan: Me, either.","Sullivan：我也是。"
"00:12:14,540 --> 00:12:19,204","Rice: But now we, after that, we kind of had to start moving to people external, which has been fun, too.","Rice：但在那之後，我們就得開始找外部的人，這也滿有趣的。"
"00:12:19,204 --> 00:12:23,577","Just because even people who are internal that aren't on the team, like you know, they see stuff on people's monitors","因為就算是公司內部、但不在團隊裡的人，他們也可能在別人的螢幕上看到東西，"
"00:12:23,580 --> 00:12:29,139","or they hear things around the office, that could like sway the data that we're getting from them a little bit.","或在辦公室聽到一些事，這可能會稍微影響我們從他們那裡得到的資料。"
"00:12:29,140 --> 00:12:35,120","So it's good to get people who are just outside, know nothing about the game, to come in and check it out.","所以找外面完全不知道這款遊戲的人進來看看，是很有幫助的。"
"00:12:36,000 --> 00:12:41,600","Schafer: Gaijin Games is right across the street and Mike Roush came over with one of his coworkers and tested the game.","Schafer：Gaijin Games 就在街對面，Mike Roush 帶了一位同事過來測試遊戲。"
"00:12:42,160 --> 00:12:44,340","Roush: It's pretty immersive.","Roush：很有沉浸感。"
"00:12:44,340 --> 00:12:45,860","It freaks me out.","讓我有點嚇到。"
"00:12:47,760 --> 00:12:49,218","Schafer: What's that?","Schafer：什麼？"
"00:12:49,220 --> 00:12:50,720","Roush: It's so immersive.","Roush：太有沉浸感了。"
"00:12:51,700 --> 00:12:56,000","Like I just, I was, just found myself just zoning out in the world.","我就發現自己完全放空，沉進那個世界裡。"
"00:12:56,380 --> 00:12:57,120","Schafer: That's acceptable.","Schafer：可以接受。"
"00:12:59,740 --> 00:13:02,629","Schafer: There's another layer of baggage, of course, when you bring in another developer,","Schafer：當然，請另一位開發者來，又會多一層包袱，"
"00:13:02,629 --> 00:13:06,609","'cause you want them to like your game, because you know, and think that it's better than their game.","因為你會希望他們喜歡你的遊戲，而且覺得它比他們的遊戲更好。"
"00:13:06,609 --> 00:13:07,329","That's the main goal.","這才是主要目標。"
"00:13:07,329 --> 00:13:10,287","You want them to go away, going God, this game is so much better.","你希望他們離開時想，天啊，這遊戲好多了。"
"00:13:10,600 --> 00:13:11,880","Well, I told you my tip.","我有跟你說過我的訣竅。"
"00:13:11,880 --> 00:13:16,160","One of tips I learned is whenever you feel like saying the word ""jealous"", just say inspired.","我學到的一個訣竅是，每當你想說「嫉妒」這個詞，就改說「受到啟發」。"
"00:13:16,300 --> 00:13:18,791","And you'll sound like a much more positive, healthy person.","這樣你聽起來會更正面、更健康。"
"00:13:19,040 --> 00:13:22,420","So I'm always really inspired when I look at other developers' games.","所以我看其他開發者的遊戲時，總是很「受到啟發」。"
"00:13:23,160 --> 00:13:25,140","Peck: I've never done that much play-testing before.","Peck：我以前從沒做過這麼多試玩測試。"
"00:13:25,840 --> 00:13:28,200","Just watching someone play an adventure game.","就是看著別人玩冒險遊戲。"
"00:13:29,702 --> 00:13:36,271","It's really, it's really like taxing on your concentration to not just be like, ohh, you know, like.","這真的，很考驗你的專注力，不能一直忍不住說，喔，你知道，就是。"
"00:13:36,614 --> 00:13:45,088","There's a lot of, there's a lot of down time mentally for the player when they're just kind of like going from one hotspot to another.","玩家只是從一個熱點移到另一個熱點時，腦袋其實會有很多放空的時間。"
"00:13:45,100 --> 00:13:58,174","Yeah, I did an internship at EA and that was very different because I was working on like this racing game on the Wii","對，我以前在 EA 實習，那很不一樣，因為我當時在做 Wii 上的一款賽車遊戲，"
"00:13:58,360 --> 00:14:05,772","and they would do a lot of testing kind of either offsite or out of sight from me.","他們會做很多測試，不是在外面做，就是在我看不到的地方做。"
"00:14:05,780 --> 00:14:14,114","I would just like see a report from somebody that they'd written up after they had, you know, I imagine gotten like a bunch of teenagers off the street","我只會看到某人寫好的報告，我想像他們大概從街上找了一群青少年，"
"00:14:14,120 --> 00:14:18,880","and paid with pizza to play the game for like a couple hours and they videotaped them","用披薩當報酬，讓他們玩幾個小時，然後把他們錄下來。"
"00:14:21,440 --> 00:14:28,580","that was, it doesn't really, obviously doesn't compare to like actually sitting on a couch behind someone and like watching them play the game.","那顯然完全不能跟真的坐在沙發上、坐在某人後面看他玩遊戲相比。"
"00:14:30,400 --> 00:14:32,560","It's a pretty amazing experience, actually.","那其實是很驚人的體驗。"
"00:14:32,560 --> 00:14:37,140","It's like watch someone play a section of the game that you, that you scripted out.","就像看著某人玩你寫好腳本的遊戲段落。"
"00:14:37,840 --> 00:14:41,540","It's really exciting and frightening and you learn a lot.","真的很興奮，也很可怕，而且你會學到很多。"
"00:14:42,980 --> 00:14:44,120","So yeah.","所以對。"
"00:14:44,660 --> 00:14:46,820","It's been a pretty positive process, I think.","我覺得整個過程滿正面的。"
"00:14:47,860 --> 00:14:49,500","The game's definitely been better for it.","遊戲也確實變得更好了。"
"00:14:51,560 --> 00:15:01,168","Roush: It's put a lot of questions into my mind, which I think is really awesome, 'cause it's like I kind of wasn't trusting mom a little bit","Roush：它讓我腦中冒出很多問題，我覺得這很棒，因為我有點開始不信任媽媽，"
"00:15:01,168 --> 00:15:04,213","and now Marek, now I don't know if trust him.","現在又有 Marek，我也不知道該不該相信他。"
"00:15:04,220 --> 00:15:10,200","So I kind of feel like I don't know, it's like I'm playing as an innocent little kid and I don't know what's going on.","所以我感覺自己像是在扮演一個天真的小孩，不知道發生了什麼事。"
"00:15:10,440 --> 00:15:14,560","And you know, in the first hour I feel very connected to him.","而且在第一個小時裡，我覺得自己跟他很有連結。"
"00:15:15,540 --> 00:15:22,020","So that's, I think that's really huge, 'cause I want to be connected to my character in a video game.","所以我覺得這很重要，因為我希望在遊戲裡跟自己的角色有連結。"
"00:15:24,700 --> 00:15:31,600","The part with the train and the avalanche, I did kind of feel, that was like the hardest for me.","火車和雪崩那段，我確實覺得那對我來說最難。"
"00:15:32,600 --> 00:15:41,380","I was kind of starting to lose a little bit of interest, whereas this, I'm just like, I want to fucking go to the next place and see what's going on.","我有點開始失去興趣，但這裡我就只是想，靠，我想去下一個地方看看發生什麼事。"
"00:15:42,600 --> 00:15:46,544","Schafer: That's the toughest, that's the toughest one because in my head I was like,","Schafer：那是最難的，最難的，因為我腦中想的是，"
"00:15:46,544 --> 00:15:52,028","OK, there'll be this routine for the boy and he'll be stuck in it and the puzzle is to get him out.","好，這男孩會有一套例行流程，他會被困在裡面，謎題就是讓他逃出來。"
"00:15:52,028 --> 00:15:56,970","So that means if you're stuck in it, it's getting repetitive and if you want to get out, that means it has to be kind of frustrating.","所以如果你被困在裡面，它就會開始重複；如果你想逃出去，它就得有點令人挫折。"
"00:15:57,820 --> 00:16:03,123","And so when people say like I found that routine really frustrating 'til I broke out of it, is that bad feedback or good feedback?","所以當大家說，我覺得那套流程在逃出來之前很挫折，這是壞回饋還是好回饋？"
"00:16:03,123 --> 00:16:05,886","Because it's almost exactly the way I'd described I wanted it to feel.","因為那幾乎正是我原本描述想要的感覺。"
"00:16:05,886 --> 00:16:08,360","But when someone actually says it to your face, ooh, it's really frustrating, that part.","可是當有人真的當面跟你說，那段真的很挫折，喔。"
"00:16:08,360 --> 00:16:13,980","Like you don't want someone to feel frustrated with your game, but that is what you were going for.","你不希望玩家對你的遊戲感到挫折，但那又正是你想達到的效果。"
"00:16:14,360 --> 00:16:15,479","Rice: I do think it was pretty good.","Rice：我確實覺得它滿好的。"
"00:16:15,480 --> 00:16:23,564","It was one of the better, I think the thing we still need to talk about, though, is like what happens if they wouldn't have gotten out there.","那算是比較好的部分之一，不過我覺得我們還需要討論的是，如果他們一直出不來會怎樣。"
"00:16:23,564 --> 00:16:26,544","If we have any plan for long, long term stuff.","我們有沒有什麼長期的應對計畫。"
"00:16:26,544 --> 00:16:31,324","Schafer: We could do, yeah, that's the thing, now we could add a failsafe for like pick whatever we think is too many missions to go for.","Schafer：我們可以，對，現在可以加個保險機制，比如選一個我們覺得任務次數太多的門檻。"
"00:16:31,324 --> 00:16:34,320","Rice: Yeah. Like I wouldn't have wanted to go much further than where they were.","Rice：對。我是不希望他們比當時走得更遠。"
"00:16:35,200 --> 00:16:38,667","Schafer: So as long as it was a good kind of frustration where they knew there was a way out","Schafer：所以只要那是好的挫折，他們知道有出路，"
"00:16:38,667 --> 00:16:42,580","and they just had to figure it out and then they did figure it out and then they felt smart and that's good.","只是得想辦法，後來也想出來了，然後覺得自己很聰明，那就很好。"
"00:16:43,820 --> 00:16:57,000","[Music] Schafer: We did all this play-testing","[音樂] Schafer：我們做了這些試玩測試，"
"00:16:57,000 --> 00:16:59,580","and we took out a bunch of places where everyone was getting stuck.","把很多大家卡住的地方拿掉。"
"00:16:59,580 --> 00:17:04,231","Then I was worried that we were making it too easy, so we went back in and took out some of the hints that we put in.","後來我又擔心我們把它做得太簡單，所以回去拿掉一些我們加進去的提示。"
"00:17:04,240 --> 00:17:06,660","And now we can test it again and make sure we didn't make it too hard again.","現在我們可以再測一次，確定沒有又把它弄得太難。"
"00:17:06,660 --> 00:17:08,207","So it's kind of a back and forth thing.","所以這就是來回調整的過程。"
"00:17:08,640 --> 00:17:10,405","But it had me thinking about Act Two.","但這讓我想到第二幕。"
"00:17:10,405 --> 00:17:15,880","That Act Two definitely has to be harder than Act One, that only makes sense, right?","第二幕當然得比第一幕難，這才合理，對吧？"
"00:17:16,460 --> 00:17:20,800","Your player is more advanced now and you're used to like these kind of puzzles.","玩家現在更進階，也已經習慣這類謎題。"
"00:17:20,800 --> 00:17:22,922","We had to kind of step up the complexity of all the puzzles.","我們得把所有謎題的複雜度提高。"
"00:17:22,922 --> 00:17:24,540","And I was thinking it was too simple.","而我本來覺得它太簡單了。"
"00:17:24,540 --> 00:17:27,200","So I'm looking at the chart again.","所以我又回頭看那張圖表。"
"00:17:29,600 --> 00:17:30,700","Nice chart, huh?","圖表不錯吧？"
"00:17:30,700 --> 00:17:31,700","Two colors.","兩種顏色。"
"00:17:32,060 --> 00:17:33,389","Offscreen Voice: That's Act Two.","畫外音：那是第二幕。"
"00:17:33,900 --> 00:17:35,540","Schafer: That's Act Two in a nutshell.","Schafer：簡單說，這就是第二幕。"
"00:17:38,120 --> 00:17:40,800","And that final picture at the bottom, looks like two testicles?","底下最後那張圖，看起來像兩顆睪丸嗎？"
"00:17:41,240 --> 00:17:43,660","That's actually the climactic scene of the game.","那其實是遊戲的高潮場面。"
"00:17:44,860 --> 00:17:47,820","There I sketched out the first shot of the game, that's the last shot of the game.","那裡我畫的是遊戲第一個鏡頭，這是最後一個鏡頭。"
"00:17:48,940 --> 00:17:55,496","I just want to make all my changes to the second half that I'm going to make now, 'cause to make them really work, some of them might have to be pre-,","我想趁現在把下半部要改的都改完，"
"00:17:55,500 --> 00:17:56,900","like set up in the First Act.","因為要讓那些改動成立，有些可能得在第一幕先鋪陳。"
"00:17:57,700 --> 00:17:59,960","So they don't just appear out of nowhere in the second Act.","這樣它們才不會在第二幕突然冒出來。"
"00:18:02,380 --> 00:18:03,324","Things are going good.","事情進展得不錯。"
"00:18:03,324 --> 00:18:05,524","I mean, this January thing is real.","我是說，一月這件事是真的了。"
"00:18:06,020 --> 00:18:12,414","When we first split the game I was like, we'll just say we're splitting the game to make Justin happy, you know.","我們一開始把遊戲拆開時，我還想說，只是說要拆，好讓 Justin 開心，"
"00:18:12,420 --> 00:18:16,240","But we really will find a way to just not have to split the game later.","但之後一定能找到辦法，不用真的拆開。"
"00:18:16,880 --> 00:18:21,167","But as the more, the closer we got, they were like, well, I think we really have to do it, so we...","可是越接近期限，他們就說，我想我們真的得這麼做，所以我們……"
"00:18:21,467 --> 00:18:22,387","We're definitely splitting it.","我們確定要拆成兩部分。"
"00:18:22,600 --> 00:18:46,200","[Music] Min: All right, let's do this. Stoddard: So moving on,","[音樂] Min：好，我們開始吧。Stoddard：那接下來，"
"00:18:46,640 --> 00:18:49,320","I'm going to give you guys kind of a broad view of the game.","我會先讓大家大致看一下遊戲全貌。"
"00:18:49,320 --> 00:18:51,420","We're going to kind of skip around the scenes and stuff.","我們會在各個場景之間跳著看。"
"00:18:51,970 --> 00:19:02,224","[squeaking, sci-fi sound fx] Stoddard: All right.","[吱嘎聲、科幻音效] Stoddard：好。"
"00:19:02,224 --> 00:19:03,580","This is the hillside.","這是山坡。"
"00:19:03,580 --> 00:19:05,120","Min: This just looks amazing.","Min：這看起來超棒。"
"00:19:05,880 --> 00:19:07,060","Correia: I love this right here. Min: Yeah.","Correia：我喜歡這裡。Min：對。"
"00:19:07,060 --> 00:19:07,948","I could be here for an hour.","我可以在這裡待上一小時。"
"00:19:08,620 --> 00:19:09,741","Min: Yeah, it just looks amazing.","Min：對，看起來真的很棒。"
"00:19:10,500 --> 00:19:11,652","Correia: And I actually dig the music.","Correia：而且我其實很喜歡音樂。"
"00:19:11,660 --> 00:19:13,000","To me, it has a Zelda vibe to it.","對我來說，有種《Zelda》的感覺。"
"00:19:13,000 --> 00:19:13,740","I don't know.","我也說不上來。"
"00:19:14,820 --> 00:19:16,433","Min: That's a good thing, I assume.","Min：我想那是好事吧。"
"00:19:16,440 --> 00:19:18,020","Correia: To me, it's a great thing.","Correia：對我來說是很棒的事。"
"00:19:18,980 --> 00:19:21,220","Min: I'm glad it passes your test.","Min：很高興它通過你的測試。"
"00:19:22,720 --> 00:19:23,956","Honest, it's fantastic.","說真的，太棒了。"
"00:19:23,960 --> 00:19:25,160","Everything sounds great.","所有聲音都很好。"
"00:19:25,560 --> 00:19:28,104","I did hear like discrepancies in terms of volume.","我有聽到音量上有些落差。"
"00:19:28,360 --> 00:19:31,920","So obviously we have mixing issues, where like the wolf was way, much louder than Shay.","所以顯然混音有問題，像狼的聲音就比 Shay 大很多。"
"00:19:31,920 --> 00:19:33,964","Correia: I just think all the dialogue in the game is too loud.","Correia：我只是覺得遊戲裡所有對話都太大聲了。"
"00:19:34,440 --> 00:19:39,463","Min: I'm not worried about the loudness as much as the relative volume of the dialogue with other dialogue.","Min：我擔心的不是整體音量，而是對話彼此的相對音量。"
"00:19:39,800 --> 00:19:41,360","Correia: Yeah, yeah. Relatively, yeah.","Correia：對，對。相對音量，沒錯。"
"00:19:41,501 --> 00:19:42,421","Min: So it's like, yeah...","Min：所以就是，對……"
"00:19:42,421 --> 00:19:44,321","O'Rourke: I noticed like a few lines, it's not like overall.","O'Rourke：我注意到幾句台詞，不是整體都這樣。"
"00:19:44,321 --> 00:19:50,189","Min: Yeah. And that's probably just a general task once everything is done, you know, that we spend, I'd say,","Min：對。那大概等全部完成後，就是一項整體工作，"
"00:19:50,468 --> 00:19:55,348","a few weeks even to get basically, you know, nuance each one of those lines.","我會說，甚至要花幾週去調整每一句台詞的細節。"
"00:19:55,348 --> 00:19:58,355","Because again, that's the star of our game, is the dialogue.","因為說到底，我們遊戲的主角就是對話。"
"00:19:58,360 --> 00:20:03,480","Correia: But the dialogue's everywhere, stepping over everything so like you could have great sound designed,","Correia：可是對話到處都有，會蓋過所有東西，就算你有很棒的音效設計，"
"00:20:03,480 --> 00:20:06,881","but it seems like half of it's getting cut out, just 'cause of the ducking and the dialogue.","好像也有一半會因為 ducking 和對話被壓掉。"
"00:20:06,881 --> 00:20:08,406","Stoddard: The ducking's very sensitive.","Stoddard：ducking 很敏感。"
"00:20:08,406 --> 00:20:09,245","Correia: Ducking's aggressive.","Correia：ducking 壓得太兇了。"
"00:20:09,245 --> 00:20:13,878","There's dialogue over everything and so the sound aside everything else has to kind of sit with it.","到處都有對話，所以其他聲音都得跟它配合。"
"00:20:13,880 --> 00:20:17,021","O'Rourke: I think that's kind of like a compromise we make in an adventure game.","O'Rourke：我覺得這有點像我們在冒險遊戲裡做的取捨。"
"00:20:17,021 --> 00:20:18,469","That little bit Correia: Yeah, yeah, exactly.","那一點。Correia：對，沒錯。"
"00:20:18,469 --> 00:20:24,540","So with that like slider, because it's so heavily dialogued, like the dialogue has to be perfect over say,","所以用那個滑桿時，因為對話量很大，對話一定得優先完美，"
"00:20:24,540 --> 00:20:25,840","having like the best...","勝過擁有最好的……"
"00:20:25,840 --> 00:20:27,200","Min: It's definitely going to be challenging.","Min：這肯定會很有挑戰。"
"00:20:27,200 --> 00:20:32,011","And this is one of those things, I think we can sell to the production team easier.","而且這種事情，我想比較容易說服製作團隊。"
"00:20:32,340 --> 00:20:39,500","But from the looks of the way the game has gone, it's just, it feels like it's just demanding this triple ""A"" attention, you know.","但從遊戲目前的樣子來看，它感覺就是需要 AAA 級的細緻度。"
"00:20:40,118 --> 00:20:43,378","To us, it's really challenging because we just don't have a triple ""A"" budget.","對我們來說真的很有挑戰，因為我們沒有 AAA 預算。"
"00:20:43,740 --> 00:20:46,441","Stoddard: I'm definitely going to be asking for some help from you guys.","Stoddard：我一定會請你們幫忙。"
"00:20:46,580 --> 00:20:48,866","Like the reverb template stuff would be huge.","像 reverb 範本那類東西會很重要。"
"00:20:48,980 --> 00:20:50,880","The Foley thing would be enormous.","Foley 也會是很大的工程。"
"00:20:51,220 --> 00:20:52,141","O'Rourke: I'm in. Min: Let's get some lunch.","O'Rourke：我加入。Min：去吃午餐吧。"
"00:20:52,800 --> 00:20:53,520","Thanks, man.","謝啦，兄弟。"
"00:20:53,520 --> 00:20:54,863","This helps a lot.","這幫了大忙。"
"00:20:55,420 --> 00:20:58,004","I've been like going out of my mind trying to get this thing...","我一直快瘋了，想把這東西……"
"00:20:58,004 --> 00:21:00,379","O'Rourke: And then we just all jump into a freeze frame, right, for the end?","O'Rourke：然後最後大家一起跳進定格畫面，對吧？"
"00:21:00,520 --> 00:21:01,920","Stoddard: Go team!","Stoddard：團隊加油！"
"00:21:03,420 --> 00:21:22,800","[Heavy stepping sounds] Min: So we are tracking Foley.","[沉重腳步聲] Min：我們正在錄 Foley。"
